37;00:04:22,719;00:04:25,420;Your Grace, if you'd like

37;00:04:22,719;00:04:25,420;to sit, I'm sure that...

38;00:04:25,472;00:04:27,723;We've been here since midday.

39;00:04:36,516;00:04:39,852;Easterners have a difference

39;00:04:36,516;00:04:39,852;sense of time, I've often found.

40;00:04:39,854;00:04:43,856;Once I was waiting for Salladhor

40;00:04:39,854;00:04:43,856;Saan here in Braavos.

41;00:04:45,275;00:04:46,525;Together, we were going to run

42;00:04:46,576;00:04:49,077;three shiploads of the finest...

43;00:05:16,306;00:05:18,490;Welcome to the Iron Bank.

44;00:05:18,525;00:05:21,777;Please, sit.

45;00:05:44,467;00:05:46,885;What can we do

45;00:05:44,467;00:05:46,885;for you, Lord Stannis?

46;00:05:46,920;00:05:48,887;This is Stannis

46;00:05:46,920;00:05:48,887;of the House Baratheon,

47;00:05:48,922;00:05:51,156;King of the Andals

47;00:05:48,922;00:05:51,156;and the First Men,

48;00:05:51,190;00:05:54,126;Lord of the Seven Kingdoms

48;00:05:51,190;00:05:54,126;and Protector of the Realm.

49;00:05:57,981;00:06:00,315;The Iron Throne

49;00:05:57,981;00:06:00,315;is currently occupied

50;00:06:00,350;00:06:02,234;by Tommen

50;00:06:00,350;00:06:02,234;of the House Baratheon,

51;00:06:02,268;00:06:03,769;King of the Andals

51;00:06:02,268;00:06:03,769;and the First Men,

52;00:06:03,771;00:06:06,688;Lord of the Seven Kingdoms

52;00:06:03,771;00:06:06,688;and Protector of the Realm.

53;00:06:06,739;00:06:09,408;He shares no blood with me.

54;00:06:09,442;00:06:12,828;He is a bastard born of incest.

55;00:06:12,862;00:06:14,913;As was his brother before him.

56;00:06:14,948;00:06:17,699;Yes, we have heard this story.

57;00:06:17,750;00:06:20,369;It's not a story.

57;00:06:17,750;00:06:20,369;It's the truth.

58;00:06:20,420;00:06:23,755;The king's grandfather

58;00:06:20,420;00:06:23,755;tells a different story.

59;00:06:23,790;00:06:26,174;A story about a jealous uncle

60;00:06:26,209;00:06:28,410;whose attempts to usurp the

60;00:06:26,209;00:06:28,410;throne from the rightful king

61;00:06:28,444;00:06:33,382;cost the Seven Kingdoms

61;00:06:28,444;00:06:33,382;dearly in blood and gold.

62;00:06:33,433;00:06:35,133;Gold you loaned him.

63;00:06:35,135;00:06:39,371;And you feel your blood gives

63;00:06:35,135;00:06:39,371;you a claim on our gold?

64;00:06:39,405;00:06:42,024;More than any man living.

65;00:06:42,058;00:06:44,977;Across the Narrow Sea,

65;00:06:42,058;00:06:44,977;your books are filled

66;00:06:45,011;00:06:48,146;with words like

66;00:06:45,011;00:06:48,146;usurper and madman

67;00:06:48,181;00:06:50,682;and blood right.

68;00:06:50,717;00:06:53,852;Here, our books

68;00:06:50,717;00:06:53,852;are filled with numbers.

69;00:06:53,886;00:06:56,071;We prefer the stories they tell.

70;00:06:56,105;00:06:58,023;More plain.

71;00:06:58,057;00:07:01,493;Less open to interpretation.

72;00:07:03,663;00:07:06,615;How many fighting men

72;00:07:03,663;00:07:06,615;remain loyal to you?

73;00:07:06,649;00:07:08,000;4,000.

74;00:07:08,051;00:07:10,002;And how many ships do you have?

75;00:07:10,053;00:07:12,304;The ones still afloat,

75;00:07:10,053;00:07:12,304;Ser Davos,

76;00:07:12,338;00:07:14,806;not at the bottom

76;00:07:12,338;00:07:14,806;of Blackwater Bay.

77;00:07:16,426;00:07:18,176;32.

78;00:07:18,227;00:07:19,978;And how much wheat

78;00:07:18,227;00:07:19,978;and barley and beef

79;00:07:20,013;00:07:22,347;and pork do you produce

79;00:07:20,013;00:07:22,347;on Dragonstone

80;00:07:22,349;00:07:27,135;to feed your 4,000 men

80;00:07:22,349;00:07:27,135;on your 32 ships?

81;00:07:29,322;00:07:31,156;None.

82;00:07:31,190;00:07:34,026;You can see why these numbers

82;00:07:31,190;00:07:34,026;seem unlikely to add up

83;00:07:34,028;00:07:37,195;to a happy ending

83;00:07:34,028;00:07:37,195;from our perspective.

84;00:07:38,598;00:07:40,966;I'm afraid we must respectfully

85;00:07:41,000;00:07:44,052;decline your request.

86;00:07:44,087;00:07:47,205;But we thank you for paying

86;00:07:44,087;00:07:47,205;us the honor of your visit.

87;00:07:56,182;00:07:57,382;My lord.

88;00:07:57,433;00:08:00,135;I'm not a lord,

88;00:07:57,433;00:08:00,135;Ser Davos Seaworth.

89;00:08:00,186;00:08:02,304;You would not be either here.

90;00:08:02,338;00:08:04,256;In Braavos,

91;00:08:04,290;00:08:07,526;thieves are not

91;00:08:04,290;00:08:07,526;rewarded with titles.

92;00:08:07,560;00:08:09,061;Well, strictly speaking,

92;00:08:07,560;00:08:09,061;I didn't do the thieving.

93;00:08:09,112;00:08:10,696;That would be the pirates.

94;00:08:10,730;00:08:14,116;I just moved what they stole

94;00:08:10,730;00:08:14,116;from one place to another.

95;00:08:15,618;00:08:17,652;This is the payment

95;00:08:15,618;00:08:17,652;that was demanded

96;00:08:17,704;00:08:18,987;by King Stannis for my crimes.

97;00:08:19,038;00:08:21,406;I consider it

97;00:08:19,038;00:08:21,406;an honest accounting.

98;00:08:21,457;00:08:23,909;He's an honest man

98;00:08:21,457;00:08:23,909;and he's your best chance

99;00:08:23,960;00:08:26,411;to get back the money

99;00:08:23,960;00:08:26,411;you've sunk into Westeros.

100;00:08:26,413;00:08:29,214;Which is a lot, I imagine.

100;00:08:26,413;00:08:29,214;Wars are expensive.

101;00:08:29,315;00:08:30,582;The war is over.

102;00:08:30,584;00:08:33,085;As long as Stannis lives,

102;00:08:30,584;00:08:33,085;the war is not over.

103;00:08:33,087;00:08:35,087;Who's the real power

103;00:08:33,087;00:08:35,087;in King's Landing?

104;00:08:35,089;00:08:37,255;Ser Davos...

104;00:08:35,089;00:08:37,255;Humor me.

105;00:08:37,257;00:08:40,892;Tywin Lannister.

105;00:08:37,257;00:08:40,892;How old is Tywin Lannister?

106;00:08:40,927;00:08:44,329;67.

106;00:08:40,927;00:08:44,329;67. And when he dies, who's in command?

107;00:08:44,363;00:08:46,431;A half-grown boy,

108;00:08:46,482;00:08:48,767;the product of incest?

109;00:08:48,801;00:08:51,603;Cersei Lannister, a queen

109;00:08:48,801;00:08:51,603;whose people despise her?

110;00:08:51,605;00:08:54,306;Jaime Lannister, a man best

110;00:08:51,605;00:08:54,306;known for killing the king

111;00:08:54,340;00:08:56,441;he was sworn to protect?

112;00:08:56,476;00:09:00,112;When Tywin's gone,

112;00:08:56,476;00:09:00,112;who do you back?

113;00:09:00,163;00:09:02,781;That is a problem

113;00:09:00,163;00:09:02,781;for another time.

114;00:09:02,832;00:09:05,083;Begging your pardon,

114;00:09:02,832;00:09:05,083;I think it's a problem for now.

115;00:09:06,452;00:09:09,254;There's only one reliable

115;00:09:06,452;00:09:09,254;leader left in Westeros.

116;00:09:09,288;00:09:11,089;Stannis.

117;00:09:11,124;00:09:12,958;He's got the birthright.

118;00:09:13,009;00:09:15,127;He's in his prime.

119;00:09:15,178;00:09:16,878;He's a tried and tested

119;00:09:15,178;00:09:16,878;battle commander.

120;00:09:16,929;00:09:19,131;And he doesn't just talk

120;00:09:16,929;00:09:19,131;about paying people back,

121;00:09:19,182;00:09:20,515;he does it.

122;00:09:24,387;00:09:27,639;The lookout sees a

122;00:09:24,387;00:09:27,639;pirate ship sailing their way.

123;00:09:27,641;00:09:29,641;The captain shouts

123;00:09:27,641;00:09:29,641;to his first mate,

124;00:09:29,692;00:09:31,526;Bring me my red shirt.

125;00:09:31,561;00:09:34,529;The first mate brings the red

125;00:09:31,561;00:09:34,529;shirt and the captain puts it on.

126;00:09:34,564;00:09:36,481;And when the pirates

126;00:09:34,564;00:09:36,481;try to board,

127;00:09:36,483;00:09:38,867;the brave captain leads

127;00:09:36,483;00:09:38,867;his men to victory.

128;00:09:38,901;00:09:42,287;A few days later,

128;00:09:38,901;00:09:42,287;the lookout screams,

129;00:09:42,321;00:09:44,122;Two pirate ships!

130;00:09:44,157;00:09:47,959;The crew is shivering

130;00:09:44,157;00:09:47,959;like scared mice.

131;00:09:47,994;00:09:49,961;But the courageous

131;00:09:47,994;00:09:49,961;captain hollers,

132;00:09:49,996;00:09:51,797;Bring me my red shirt!

133;00:09:51,831;00:09:54,049;After the battle,

133;00:09:51,831;00:09:54,049;the first mate asks,

134;00:09:54,083;00:09:57,919;Captain, why do you call for

134;00:09:54,083;00:09:57,919;your red shirt before battle?

135;00:09:57,970;00:09:59,504;The captain replies,

136;00:09:59,555;00:10:03,341;So that if I am stabbed,

136;00:09:59,555;00:10:03,341;you will not see me bleed.

137;00:10:03,392;00:10:05,594;The next morning

137;00:10:03,392;00:10:05,594;the lookout screams,

138;00:10:05,645;00:10:08,096;10 pirate ships!

139;00:10:08,147;00:10:10,932;We are surrounded!

140;00:10:11,017;00:10:12,734;The crew goes silent.

141;00:10:12,768;00:10:15,270;They all look

141;00:10:12,768;00:10:15,270;to their brave captain,

142;00:10:15,321;00:10:17,405;waiting for his usual command.

143;00:10:17,440;00:10:19,441;Calm as ever,

143;00:10:17,440;00:10:19,441;the captain bellows...

144;00:10:19,492;00:10:21,860;Bring me my brown pants!

145;00:10:24,697;00:10:28,166;You think they ever met a pirate

145;00:10:24,697;00:10:28,166;who didn't tell them that joke?

146;00:10:28,201;00:10:31,620;Davos.

147;00:10:31,704;00:10:34,039;I heard you were rotting in

147;00:10:31,704;00:10:34,039;a dungeon in Dragonstone.

148;00:10:34,041;00:10:36,374;Only half rotted.

149;00:10:38,961;00:10:41,096;Join us, my friend. Join us.

150;00:10:41,130;00:10:44,049;This is Lhara.

151;00:10:44,051;00:10:45,650;And this is...

151;00:10:44,051;00:10:45,650;I am Lhara.

152;00:10:48,889;00:10:51,356;She's an artist,

152;00:10:48,889;00:10:51,356;this one, truly.

153;00:10:51,390;00:10:54,726;No time, I'm afraid.

153;00:10:51,390;00:10:54,726;We sail at sunrise.

154;00:10:54,777;00:10:56,194;We?

155;00:10:56,229;00:10:58,396;You, me... we.

156;00:11:00,566;00:11:03,735;Once I thought

156;00:11:00,566;00:11:03,735;this man loved me.

157;00:11:03,737;00:11:07,906;Now I know he despises me.

158;00:11:07,908;00:11:12,294;He wants to see me die poor

158;00:11:07,908;00:11:12,294;and alone on some cold...

159;00:11:22,255;00:11:23,922;You won't be alone.

160;00:11:23,924;00:11:25,473;And you won't be poor.

161;00:11:33,266;00:11:35,850;There's a chest of the good

161;00:11:33,266;00:11:35,850;stuff left back at your house.

162;00:11:35,902;00:11:37,769;I gave it to your wife.

163;00:11:41,073;00:11:43,441;You're not my friend, my friend.

164;00:11:45,244;00:11:47,078;I'll see you at sunrise.

165;00:11:50,082;00:11:52,334;I give you

165;00:11:50,082;00:11:52,334;until the full moon

166;00:11:52,368;00:11:55,954;to order all ironborn

166;00:11:52,368;00:11:55,954;scum out of the North

167;00:11:56,005;00:11:59,674;and back to those shit-stained

167;00:11:56,005;00:11:59,674;rocks you call home.

168;00:11:59,709;00:12:01,710;On the first night

168;00:11:59,709;00:12:01,710;of the full moon,

169;00:12:01,761;00:12:04,512;I will hunt down every

169;00:12:01,761;00:12:04,512;islander still on our lands

170;00:12:04,547;00:12:06,464;and flay them living,

171;00:12:06,466;00:12:09,134;the way I flayed

171;00:12:06,466;00:12:09,134;the 20 ironborn scum

172;00:12:09,185;00:12:10,769;I found at Winterfell.

173;00:12:12,021;00:12:14,639;In the box you'll find

173;00:12:12,021;00:12:14,639;a special gift...

174;00:12:15,691;00:12:18,143;Theon's favorite toy.

175;00:12:18,194;00:12:20,979;He cried when I took

175;00:12:18,194;00:12:20,979;it away from him.

176;00:12:22,365;00:12:25,150;Leave the North now

176;00:12:22,365;00:12:25,150;or more boxes will follow

177;00:12:25,152;00:12:27,319;with more Theon.

178;00:12:27,370;00:12:29,371;Signed Ramsay Snow,

179;00:12:29,405;00:12:32,824;natural born son

179;00:12:29,405;00:12:32,824;of Roose Bolton,

180;00:12:32,826;00:12:34,826;Lord of the Dreadfort

181;00:12:34,828;00:12:37,796;and Warden of the North.

182;00:12:37,830;00:12:39,798;Yes!

183;00:12:39,882;00:12:41,967;They skinned our countrymen

184;00:12:42,001;00:12:44,753;and they mutilated my brother,

185;00:12:44,804;00:12:47,138;your prince.

186;00:12:47,173;00:12:49,224;Your prince.

187;00:12:49,258;00:12:52,010;Everything they've done to him,

188;00:12:52,012;00:12:54,095;they've also done to you.

189;00:12:54,146;00:12:55,563;Yes! Yes!

190;00:12:55,598;00:12:59,517;As long as they can hurt

190;00:12:55,598;00:12:59,517;our prince with impunity,

191;00:12:59,519;00:13:03,521;the word ironborn means nothing.

192;00:13:27,463;00:13:29,381;Go left.

193;00:13:37,724;00:13:40,558;Theon Greyjoy.

193;00:13:37,724;00:13:40,558;I don't know...

194;00:13:40,643;00:13:41,943;I'm here for Theon Greyjoy.

195;00:13:41,977;00:13:43,311;Take me to the dungeons.

196;00:13:43,362;00:13:45,563;He's not in the dungeons.

197;00:14:09,922;00:14:12,090;Last cage on the right.

197;00:14:09,922;00:14:12,090;Thank you.

198;00:14:14,810;00:14:16,594;This way!

199;00:14:30,443;00:14:31,993;We're going home.

200;00:14:33,829;00:14:35,747;No!

201;00:14:37,950;00:14:41,920;It's all right. It's me, Yara.

202;00:14:41,954;00:14:44,089;You can't trick me.

203;00:14:44,123;00:14:46,291;Tell him. Tell him you

203;00:14:44,123;00:14:46,291;couldn't trick me.

204;00:14:46,293;00:14:48,126;I'm not tricking you, Theon.

204;00:14:46,293;00:14:48,126;I'm saving you.

205;00:14:48,128;00:14:49,511;Not Theon! Reek!

206;00:14:49,595;00:14:51,296;Reek! My name is Reek!

206;00:14:49,595;00:14:51,296;-  They're here.

207;00:14:51,298;00:14:52,797;If they catch us

207;00:14:51,298;00:14:52,797;in here, we're trapped.

208;00:14:52,799;00:14:54,466;Help me with him.

209;00:14:54,517;00:14:56,384;No, you can't!

210;00:14:56,435;00:14:58,186;You can't!

210;00:14:56,435;00:14:58,186;You're Theon Greyjoy.

211;00:14:58,220;00:15:02,357;No, I don't believe her!

211;00:14:58,220;00:15:02,357;I know who I am!

212;00:15:02,391;00:15:05,643;I'm Reek! Reek! Loyal Reek!

213;00:15:05,694;00:15:08,480;Good Reek!

213;00:15:05,694;00:15:08,480;I've always been Reek!

214;00:15:18,874;00:15:21,826;This is turning into

214;00:15:18,874;00:15:21,826;a lovely evening.

215;00:15:38,227;00:15:39,727;I'm Reek!

216;00:15:39,762;00:15:41,679;Loyal Reek!

217;00:15:48,904;00:15:51,105;Aah! Theon!

218;00:16:07,588;00:16:10,590;Give me my broth You've got

218;00:16:07,588;00:16:10,590;bigger balls than he ever did.

219;00:16:12,476;00:16:16,345;But with those big balls

219;00:16:12,476;00:16:16,345;of yours...

220;00:16:21,351;00:16:23,519;how fast can you run?

221;00:16:35,082;00:16:36,999;Make for the ship, now.

222;00:16:37,034;00:16:38,701;But your brother.

223;00:16:38,752;00:16:40,703;My brother is dead.

224;00:16:48,295;00:16:51,180;I have a treat for you.

225;00:16:51,215;00:16:52,882;A reward.

226;00:16:52,933;00:16:55,468;Reward?

227;00:16:56,603;00:16:57,770;Yes, Reek.

228;00:16:57,805;00:17:00,723;Those creatures

228;00:16:57,805;00:17:00,723;who came in the night,

229;00:17:00,725;00:17:03,392;they wanted to take you away.

230;00:17:03,394;00:17:05,361;And you didn't let them.

231;00:17:05,395;00:17:07,797;You remained loyal.

232;00:17:07,831;00:17:11,734;I... I didn't want

232;00:17:07,831;00:17:11,734;them to take me.

233;00:17:13,070;00:17:14,487;I was so scared.

234;00:17:14,538;00:17:16,823;I didn't want them...

234;00:17:14,538;00:17:16,823;Yes, yes, Reek.

235;00:17:25,833;00:17:28,050;It's a bath.

236;00:17:28,085;00:17:30,419;For you.

237;00:17:33,590;00:17:36,142;Remove those rags.

238;00:17:37,344;00:17:39,178;Now.

239;00:17:55,829;00:17:57,780;The britches, too, Reek.

240;00:17:57,831;00:17:59,448;Take them off.

241;00:19:25,702;00:19:28,371;Do you love me, Reek?

242;00:19:34,261;00:19:36,879;Yes, of course, my lord.

243;00:19:38,632;00:19:40,132;Good.

244;00:19:40,183;00:19:42,518;Because I need you

244;00:19:40,183;00:19:42,518;to do something for me.

245;00:19:42,552;00:19:44,604;Something very important.

246;00:19:44,638;00:19:47,890;There's a castle, you see.

247;00:19:47,941;00:19:51,027;Some bad men hold this castle.

248;00:19:52,396;00:19:55,231;I need your help

248;00:19:52,396;00:19:55,231;to take this castle back.

249;00:19:58,785;00:20:00,536;But how can...

250;00:20:02,906;00:20:05,074;I need you to play a role.

251;00:20:06,243;00:20:09,161;To pretend to be someone

251;00:20:06,243;00:20:09,161;you're not.

252;00:20:12,749;00:20:14,917;Pretend to be who?

253;00:20:14,919;00:20:17,753;Theon Greyjoy.

254;00:21:26,323;00:21:27,323;_

255;00:21:30,983;00:21:32,505;_

256;00:21:32,625;00:21:33,503;_

257;00:21:33,623;00:21:35,274;_

258;00:21:35,394;00:21:37,744;_

259;00:21:38,004;00:21:40,149;_

260;00:21:40,269;00:21:43,876;_

261;00:21:44,492;00:21:46,924;_

262;00:21:49,163;00:21:51,296;_

263;00:22:04,244;00:22:05,644;He is a goatherd.

264;00:22:05,679;00:22:09,215;He says he prayed for your victory

264;00:22:05,679;00:22:09,215;against the slave masters.

265;00:22:09,249;00:22:11,851;I thank him for his prayers.

266;00:22:27,384;00:22:29,351;It was your dragons, he says.

267;00:22:29,386;00:22:32,938;They came this morning

267;00:22:29,386;00:22:32,938;for his flock.

268;00:22:36,993;00:22:39,061;He hopes he has not

268;00:22:36,993;00:22:39,061;offended Your Grace,

269;00:22:39,096;00:22:40,729;but now he has nothing.

270;00:22:42,149;00:22:43,949;Tell this man I am sorry

270;00:22:42,149;00:22:43,949;for his hardship.

271;00:22:43,984;00:22:47,803;I cannot bring back his goats,

272;00:22:47,838;00:22:52,658;but I will see he is paid

272;00:22:47,838;00:22:52,658;their value three times over.

273;00:23:09,059;00:23:11,260;Send the next one in.

274;00:23:19,113;00:23:20,113;_

275;00:23:25,443;00:23:26,443;_

276;00:23:45,262;00:23:46,929;Queen Daenerys.

277;00:23:46,963;00:23:49,014;Tales of your beauty

277;00:23:46,963;00:23:49,014;were not exaggerated.

278;00:23:49,049;00:23:51,100;I thank you.

279;00:23:51,134;00:23:54,136;Mine is one of the oldest and

279;00:23:51,134;00:23:54,136;proudest families in Meereen.

280;00:23:54,171;00:23:56,805;Then it is my honor

280;00:23:54,171;00:23:56,805;to receive you.

281;00:23:56,840;00:23:59,775;My father, one of

281;00:23:56,840;00:23:59,775;Meereen's most respected

282;00:23:59,809;00:24:02,778;and beloved citizens,

282;00:23:59,809;00:24:02,778;oversaw the restoration

283;00:24:02,812;00:24:05,114;and maintenance

283;00:24:02,812;00:24:05,114;of its greatest landmarks.

284;00:24:05,148;00:24:06,665;This pyramid included.

285;00:24:06,700;00:24:08,868;For that, he has my gratitude.

286;00:24:08,902;00:24:10,569;I should be honored to meet him.

287;00:24:10,604;00:24:12,054;You have, Your Grace.

288;00:24:12,088;00:24:13,889;You crucified him.

289;00:24:16,126;00:24:18,160;I pray you'll never live to see

290;00:24:18,211;00:24:20,162;a member of your family

290;00:24:18,211;00:24:20,162;treated so cruelly.

291;00:24:20,213;00:24:23,732;Your father crucified

291;00:24:20,213;00:24:23,732;innocent children.

292;00:24:23,800;00:24:27,219;My father spoke out against

292;00:24:23,800;00:24:27,219;crucifying those children.

293;00:24:27,254;00:24:30,456;He decried it as a criminal

293;00:24:27,254;00:24:30,456;act, but was overruled.

294;00:24:30,490;00:24:33,826;Is it justice to answer

294;00:24:30,490;00:24:33,826;one crime with another?

295;00:24:33,894;00:24:36,312;I am sorry you no longer

295;00:24:33,894;00:24:36,312;have a father,

296;00:24:36,346;00:24:39,682;but my treatment

296;00:24:36,346;00:24:39,682;of the masters was no crime.

297;00:24:39,733;00:24:42,501;You'd be wise to remember that.

298;00:24:42,535;00:24:45,487;What's done is done.

299;00:24:45,522;00:24:48,657;You are the queen and I

299;00:24:45,522;00:24:48,657;am a servant of Meereen.

300;00:24:48,692;00:24:52,361;A servant who does not wish to

300;00:24:48,692;00:24:52,361;see its traditions eradicated.

301;00:24:52,363;00:24:55,197;And what traditions

301;00:24:52,363;00:24:55,197;do you speak of?

302;00:24:55,199;00:24:57,199;The tradition of funeral rite.

303;00:24:57,250;00:24:59,535;Proper burial in

303;00:24:57,250;00:24:59,535;the Temple of the Graces.

304;00:24:59,586;00:25:04,123;My father and 162

304;00:24:59,586;00:25:04,123;noble Meereenese

305;00:25:04,174;00:25:06,508;are still nailed to those posts,

306;00:25:06,543;00:25:09,712;carrion for vultures,

306;00:25:06,543;00:25:09,712;rotting in the sun.

307;00:25:18,922;00:25:21,774;Your Grace, I ask that you

307;00:25:18,922;00:25:21,774;order these men taken down

308;00:25:21,808;00:25:24,026;so that they might receive

308;00:25:21,808;00:25:24,026;proper burials.

309;00:25:24,060;00:25:28,230;And what of the slave children

309;00:25:24,060;00:25:28,230;these noble Meereenese crucified?

310;00:25:28,232;00:25:30,733;They were rotting

310;00:25:28,232;00:25:30,733;in the sun as well.

311;00:25:30,735;00:25:34,403;Would you have begged me for

311;00:25:30,735;00:25:34,403;their right to a proper burial?

312;00:25:34,454;00:25:37,156;Your Grace, I cannot defend

312;00:25:34,454;00:25:37,156;the actions of the masters.

313;00:25:37,240;00:25:41,126;I can only speak to you as a

313;00:25:37,240;00:25:41,126;son who loved his father.

314;00:25:41,161;00:25:43,412;Let me take his body down.

315;00:25:43,414;00:25:46,298;Let me have him brought

315;00:25:43,414;00:25:46,298;to the temple

316;00:25:46,333;00:25:47,833;and buried with dignity

317;00:25:47,884;00:25:50,252;so that he might find

317;00:25:47,884;00:25:50,252;peace in the next world.

318;00:25:53,490;00:25:57,142;Bury your father,

318;00:25:53,490;00:25:57,142;Hizdahr zo Loraq.

319;00:26:00,930;00:26:04,149;Thank you, my queen.

320;00:26:15,695;00:26:17,129;How many more?

321;00:26:17,163;00:26:20,449;There are 212 supplicants

321;00:26:17,163;00:26:20,449;waiting, Your Grace.

322;00:26:20,533;00:26:23,285;212?

323;00:26:30,760;00:26:33,262;Send the next one in.

324;00:26:35,181;00:26:37,883;These meetings aren't always going

324;00:26:35,181;00:26:37,883;to be this early, are they?

325;00:26:37,934;00:26:41,020;I was up late last night.

326;00:26:41,054;00:26:45,057;So, does this mean I am a

326;00:26:41,054;00:26:45,057;master of something now?

327;00:26:45,108;00:26:46,975;Coins, ships?

328;00:26:46,977;00:26:49,228;Lord Tywin and I

328;00:26:46,977;00:26:49,228;already determined

329;00:26:49,279;00:26:52,481;that I shall be the Master

329;00:26:49,279;00:26:52,481;of Ships long before you...

330;00:26:57,320;00:26:59,488;Lord Tywin, it's a great honor

331;00:26:59,539;00:27:01,990;to have been granted a

331;00:26:59,539;00:27:01,990;seat on this council. I...

332;00:27:01,992;00:27:03,992;The trial

332;00:27:01,992;00:27:03,992;begins this afternoon.

333;00:27:04,044;00:27:06,211;We only have the morning

333;00:27:04,044;00:27:06,211;for affairs of state.

334;00:27:06,246;00:27:07,713;Shall we begin?

335;00:27:07,747;00:27:09,748;Sandor Clegane

335;00:27:07,747;00:27:09,748;has been spotted

336;00:27:09,799;00:27:12,584;in the Riverlands, my lord.

337;00:27:12,635;00:27:13,969;A coward and a traitor.

338;00:27:14,003;00:27:18,257;My birds tell me the Hound

338;00:27:14,003;00:27:18,257;slaughtered five of our soldiers.

339;00:27:18,308;00:27:21,009;I believe the phrase

339;00:27:18,308;00:27:21,009;fuck the king was uttered.

340;00:27:21,011;00:27:22,811;Disgraceful.

341;00:27:22,846;00:27:24,680;What would it take

341;00:27:22,846;00:27:24,680;to make the common soldier

342;00:27:24,682;00:27:26,982;stupid enough to try

342;00:27:24,682;00:27:26,982;his luck with the Hound?

343;00:27:27,016;00:27:29,585;10 silver stags

343;00:27:27,016;00:27:29,585;seems a generous bounty.

344;00:27:29,619;00:27:32,438;Make it 100. What else?

345;00:27:32,489;00:27:35,023;More whispers

345;00:27:32,489;00:27:35,023;from the east, my lord.

346;00:27:35,075;00:27:36,608;The Targaryen girl?

347;00:27:36,659;00:27:39,445;Daenerys has taken up

347;00:27:36,659;00:27:39,445;residence in Meereen.

348;00:27:39,496;00:27:43,098;She has conquered the city

348;00:27:39,496;00:27:43,098;and rules as its queen.

349;00:27:43,133;00:27:44,700;Conquered with what?

350;00:27:44,751;00:27:46,668;She commands an army

350;00:27:44,751;00:27:46,668;of Unsullied, my queen.

351;00:27:46,703;00:27:48,704;Some 8,000 strong.

352;00:27:48,738;00:27:51,039;She has a company

352;00:27:48,738;00:27:51,039;of sellswords...

353;00:27:51,041;00:27:52,424;the Second Sons.

354;00:27:52,459;00:27:54,877;She has two knights

354;00:27:52,459;00:27:54,877;advising her...

355;00:27:54,911;00:27:58,180;Jorah Mormont

355;00:27:54,911;00:27:58,180;and Barristan Selmy.

356;00:27:58,214;00:28:00,215;And she has three dragons.

357;00:28:00,266;00:28:01,683;Baby dragons.

358;00:28:01,718;00:28:03,852;Larger every year, Your Grace.

359;00:28:03,887;00:28:07,356;Mormont is spying on her for us.

360;00:28:07,390;00:28:10,359;No longer. He appears

360;00:28:07,390;00:28:10,359;to be fully devoted to her.

361;00:28:10,393;00:28:13,395;As for Ser Barristan,

361;00:28:10,393;00:28:13,395;it would seem

362;00:28:13,430;00:28:16,064;he took his dismissal

362;00:28:13,430;00:28:16,064;from the Kingsguard

363;00:28:16,066;00:28:17,900;a bit harder than anticipated.

364;00:28:17,902;00:28:19,818;He's an old man.

365;00:28:19,869;00:28:21,770;He wasn't fit to protect my son.

366;00:28:21,805;00:28:23,822;Joffrey didn't die on his watch.

367;00:28:23,873;00:28:27,159;Dismissing him was as

367;00:28:23,873;00:28:27,159;insulting as it was stupid.

368;00:28:27,210;00:28:30,312;Don't tell me you're worried about

368;00:28:27,210;00:28:30,312;a child halfway across the world.

369;00:28:30,346;00:28:33,916;A child with two seasoned

369;00:28:30,346;00:28:33,916;warriors counseling her

370;00:28:33,950;00:28:37,169;and a powerful army

