,0,1,2,3,4
332,24,332,cersei,His life is in danger,"['Cersei Lannister', 'Joffrey Baratheon']"
333,24,333,joffrey,Were at war All our lives are in danger I heard a disgusting lie about Uncle Jaime And you,"['Cersei Lannister', 'Joffrey Baratheon']"
334,24,334,cersei,Our enemies will say anything to weaken your claim to the throne,"['Cersei Lannister', 'Joffrey Baratheon']"
335,24,335,joffrey,Its not a claim The throne is mine,"['Cersei Lannister', 'Joffrey Baratheon']"
336,24,336,cersei,Of course it is No one believes this foul gossip,"['Cersei Lannister', 'Joffrey Baratheon']"
337,24,337,joffrey,Someone believes it Father had other children? Besides me and Tommen and Myrcella?,"['Cersei Lannister', 'Joffrey Baratheon']"
338,24,338,cersei,What are you asking?,"['Cersei Lannister', 'Joffrey Baratheon']"
339,24,339,joffrey,Im asking if he fucked other women when he grew tired of you How many bastards does he have running,"['Cersei Lannister', 'Joffrey Baratheon']"
340,24,340,joffrey,"What you just did is punishable by death You will never do it again Never That will be all, Mother","['Cersei Lannister', 'Joffrey Baratheon']"
341,25,341,roz,"No, no, no, no Do you have any idea how ridiculous you sound? Ease into it Slowly, with passion","['Ros', 'Armeca', 'Daisy']"
342,25,342,roz,Go wash yourselves Put some clothes on Both of you are working tonight,"['Ros', 'Armeca', 'Daisy']"
343,26,343,roz,"We do things differently here, Daisy This isnt some five-copper bawdy house in Hayseed Hall","['Ros', 'Daisy', 'Janos Slynt', 'Mhaegen', 'Barra']"
344,26,344,daisy,Haystack Hall,"['Ros', 'Daisy', 'Janos Slynt', 'Mhaegen', 'Barra']"
345,26,345,roz,Wherever youre from Our establishment doesnt cater to ploughmen and goat herders Lord Olsen Taste is everything here,"['Ros', 'Daisy', 'Janos Slynt', 'Mhaegen', 'Barra']"
346,26,346,daisy,Littlefingers a fancy man,"['Ros', 'Daisy', 'Janos Slynt', 'Mhaegen', 'Barra']"
347,26,347,roz,"Dont call him Littlefinger, he doesnt like it Lord Baelish","['Ros', 'Daisy', 'Janos Slynt', 'Mhaegen', 'Barra']"
348,26,348,roz,She pretends she doesnt speak the common tongue so that people will think shes exotic She grew up just down the road in flea bottom,"['Ros', 'Daisy', 'Janos Slynt', 'Mhaegen', 'Barra']"
349,26,349,daisy,Shes beautiful,"['Ros', 'Daisy', 'Janos Slynt', 'Mhaegen', 'Barra']"
350,26,350,roz,"Shes a dumb slut, really, but a lid for every pot Lord Commander Good to see you, again","['Ros', 'Daisy', 'Janos Slynt', 'Mhaegen', 'Barra']"
351,26,351,roz,"You do realize this establishment is owned by Lord Petyr Baelish, the Kings Master of Coin Coin which goes in many pockets","['Ros', 'Daisy', 'Janos Slynt', 'Mhaegen', 'Barra']"
352,26,352,janos,Orders,"['Ros', 'Daisy', 'Janos Slynt', 'Mhaegen', 'Barra']"
353,26,353,roz,Whose orders?,"['Ros', 'Daisy', 'Janos Slynt', 'Mhaegen', 'Barra']"
354,26,354,janos,Someone who doesnt care what Littlefinger thinks,"['Ros', 'Daisy', 'Janos Slynt', 'Mhaegen', 'Barra']"
355,26,355,mhaegan,"No, you cant","['Ros', 'Daisy', 'Janos Slynt', 'Mhaegen', 'Barra']"
356,26,356,mhaegan,No! Please! No! Not my Barra! Please Please,"['Ros', 'Daisy', 'Janos Slynt', 'Mhaegen', 'Barra']"
357,26,357,janos,Enough Get it done Kill the bastard,"['Ros', 'Daisy', 'Janos Slynt', 'Mhaegen', 'Barra']"
358,26,358,janos,Give it here,"['Ros', 'Daisy', 'Janos Slynt', 'Mhaegen', 'Barra']"
359,27,359,gold cloak,"Spread out! Search every house, every room Look in every room",[]
360,28,360,blacksmith,Gendry! His name is Gendry,"['Janos Slynt', 'Tobho Mott']"
361,28,361,janos,Where is the bastard?,"['Janos Slynt', 'Tobho Mott']"
362,28,362,blacksmith,"The Nights Watch! Please, stop","['Janos Slynt', 'Tobho Mott']"
363,28,363,janos,Where?,"['Janos Slynt', 'Tobho Mott']"
364,28,364,blacksmith,"They took him up the Kingsroad, heading north","['Janos Slynt', 'Tobho Mott']"
365,28,365,janos,How will we know him?,"['Janos Slynt', 'Tobho Mott']"
366,28,366,blacksmith,Hes got a bulls head helmet He made it himself,"['Janos Slynt', 'Tobho Mott']"
