,0,1,2,3,4
0,1,0,man,Yah! Yah,[]
1,2,1,man,"Go, move out","['Sandor Clegane', 'Arya Stark']"
2,2,2,frey men,ing in the North! ing in the North! he King in the North! ing in the North,"['Sandor Clegane', 'Arya Stark']"
3,2,3,frey men,ing in the North! ing in the North,"['Sandor Clegane', 'Arya Stark']"
4,3,4,frey man,Here comes the King in the North! Here comes the King in the North,"['Sandor Clegane', 'Arya Stark', 'Robb Stark', 'Grey Wind']"
5,3,5,frey men,ing in the North! ing in the North,"['Sandor Clegane', 'Arya Stark', 'Robb Stark', 'Grey Wind']"
6,3,6,frey man,Here comes,"['Sandor Clegane', 'Arya Stark', 'Robb Stark', 'Grey Wind']"
7,5,7,tyrion,Hmm Ser Eldrick Sarsfield and Lord Desmond Crakehall Ser Eldrick Sarsfield and Lord Desmond Crakehall,"['Sansa Stark', 'Tyrion Lannister', 'Shae', 'Desmond Crakehall', 'Eldrick Sarsfield']"
8,5,8,sansa,What are you doing?,"['Sansa Stark', 'Tyrion Lannister', 'Shae', 'Desmond Crakehall', 'Eldrick Sarsfield']"
9,5,9,tyrion,I have a list,"['Sansa Stark', 'Tyrion Lannister', 'Shae', 'Desmond Crakehall', 'Eldrick Sarsfield']"
10,5,10,sansa,A list of people you mean to kill?,"['Sansa Stark', 'Tyrion Lannister', 'Shae', 'Desmond Crakehall', 'Eldrick Sarsfield']"
11,5,11,tyrion,"For laughing at me? Do I look like Joffrey to you? No, death seems a bit extreme Fear of death, on the other hand-","['Sansa Stark', 'Tyrion Lannister', 'Shae', 'Desmond Crakehall', 'Eldrick Sarsfield']"
12,6,12,sansa,You should learn to ignore them,"['Sansa Stark', 'Tyrion Lannister', 'Shae']"
13,6,13,tyrion,"My lady, people have been laughing at me far longer than theyve been laughing at you Im the Halfman, the Demon Monkey, the Imp","['Sansa Stark', 'Tyrion Lannister', 'Shae']"
14,6,14,sansa,Youre a Lannister I am the disgraced daughter of the traitor Ned Stark,"['Sansa Stark', 'Tyrion Lannister', 'Shae']"
15,6,15,tyrion,The disgraced daughter and the Demon Monkey Were perfect for each other,"['Sansa Stark', 'Tyrion Lannister', 'Shae']"
16,6,16,sansa,So how should we punish them?,"['Sansa Stark', 'Tyrion Lannister', 'Shae']"
17,6,17,tyrion,Who? Whom?,"['Sansa Stark', 'Tyrion Lannister', 'Shae']"
18,6,18,sansa,Ser Eldrick Sarsfield and Lord Desmond Crakehall,"['Sansa Stark', 'Tyrion Lannister', 'Shae']"
19,6,19,tyrion,Ah I could speak to Lord Varys and learn their perversions Anyone named Desmond Crakehall must be a pervert,"['Sansa Stark', 'Tyrion Lannister', 'Shae']"
20,6,20,sansa,I hear that youre a pervert,"['Sansa Stark', 'Tyrion Lannister', 'Shae']"
21,6,21,tyrion,I am the Imp I have certain standards to maintain,"['Sansa Stark', 'Tyrion Lannister', 'Shae']"
22,6,22,sansa,"We could sheep shift Lord Desmonds bed You cut a little hole in his mattress and you stuff sheep dung inside Then you sew up the hole and make his bed again His room will stink, but he wont know where its coming from","['Sansa Stark', 'Tyrion Lannister', 'Shae']"
23,6,23,tyrion,Lady Sansa,"['Sansa Stark', 'Tyrion Lannister', 'Shae']"
24,6,24,sansa,My sister used to do that when she was angry with me And she was always angry with me,"['Sansa Stark', 'Tyrion Lannister', 'Shae']"
25,6,25,tyrion,Why sheep shift?,"['Sansa Stark', 'Tyrion Lannister', 'Shae']"
26,6,26,sansa,Thats the vulgar word for dung,"['Sansa Stark', 'Tyrion Lannister', 'Shae']"
27,6,27,tyrion,My lady-,"['Sansa Stark', 'Tyrion Lannister', 'Shae']"
28,6,28,sansa,"Well, you asked me","['Sansa Stark', 'Tyrion Lannister', 'Shae']"
29,6,29,girl,Oh! Thats him,"['Sansa Stark', 'Tyrion Lannister', 'Shae']"
30,8,30,tyrion,Killed a few puppies today?,"['Tyrion Lannister', 'Tywin Lannister', 'Joffrey Baratheon', 'Cersei Lannister', 'Lord Varys', 'Grand Maester Pycelle']"
31,8,31,joffrey,"Show him Come on, show him","['Tyrion Lannister', 'Tywin Lannister', 'Joffrey Baratheon', 'Cersei Lannister', 'Lord Varys', 'Grand Maester Pycelle']"
32,8,32,pycelle,"Oh, apologies, my lord Old fingers","['Tyrion Lannister', 'Tywin Lannister', 'Joffrey Baratheon', 'Cersei Lannister', 'Lord Varys', 'Grand Maester Pycelle']"
33,8,33,tyrion,Roslin caught a fine fat trout Her brothers gave her a pair of wolf pelts for her wedding Signed Walder Frey Is that bad poetry or is it supposed to mean something?,"['Tyrion Lannister', 'Tywin Lannister', 'Joffrey Baratheon', 'Cersei Lannister', 'Lord Varys', 'Grand Maester Pycelle']"
34,8,34,joffrey,Robb Stark is dead And his bitch mother Write back to Lord Frey Thank him for his service and command him to send Robb Starks head Im going to serve it to Sansa at my wedding feast,"['Tyrion Lannister', 'Tywin Lannister', 'Joffrey Baratheon', 'Cersei Lannister', 'Lord Varys', 'Grand Maester Pycelle']"
35,8,35,varys,"Your Grace, Lady Sansa is your aunt by marriage","['Tyrion Lannister', 'Tywin Lannister', 'Joffrey Baratheon', 'Cersei Lannister', 'Lord Varys', 'Grand Maester Pycelle']"
36,8,36,cersei,A joke Joffrey did not mean it,"['Tyrion Lannister', 'Tywin Lannister', 'Joffrey Baratheon', 'Cersei Lannister', 'Lord Varys', 'Grand Maester Pycelle']"
37,8,37,joffrey,"Yes, I did Im going to have it served to Sansa at my wedding feast","['Tyrion Lannister', 'Tywin Lannister', 'Joffrey Baratheon', 'Cersei Lannister', 'Lord Varys', 'Grand Maester Pycelle']"
38,8,38,tyrion,No She is no longer yours to torment,"['Tyrion Lannister', 'Tywin Lannister', 'Joffrey Baratheon', 'Cersei Lannister', 'Lord Varys', 'Grand Maester Pycelle']"
39,8,39,joffrey,"Everyone is mine to torment Youd do well to remember that, you little monster","['Tyrion Lannister', 'Tywin Lannister', 'Joffrey Baratheon', 'Cersei Lannister', 'Lord Varys', 'Grand Maester Pycelle']"
40,8,40,tyrion,"Oh, Im a monster Perhaps you should speak to me more softly, then Monsters are dangerous and just now kings are dying like flies","['Tyrion Lannister', 'Tywin Lannister', 'Joffrey Baratheon', 'Cersei Lannister', 'Lord Varys', 'Grand Maester Pycelle']"
41,8,41,joffrey,I could have your tongue out for saying that,"['Tyrion Lannister', 'Tywin Lannister', 'Joffrey Baratheon', 'Cersei Lannister', 'Lord Varys', 'Grand Maester Pycelle']"
42,8,42,cersei,Let him make his threats Hmm? Hes a bitter little man,"['Tyrion Lannister', 'Tywin Lannister', 'Joffrey Baratheon', 'Cersei Lannister', 'Lord Varys', 'Grand Maester Pycelle']"
43,8,43,pycelle,"Lord Tyrion should apologize immediately Unacceptable, disrespectful, and in very bad taste","['Tyrion Lannister', 'Tywin Lannister', 'Joffrey Baratheon', 'Cersei Lannister', 'Lord Varys', 'Grand Maester Pycelle']"
44,8,44,joffrey,I am the king! I will punish you,"['Tyrion Lannister', 'Tywin Lannister', 'Joffrey Baratheon', 'Cersei Lannister', 'Lord Varys', 'Grand Maester Pycelle']"
45,8,45,tywin,"Any man who must say, I am the king is no true king Ill make sure you understand that when Ive won your war for you","['Tyrion Lannister', 'Tywin Lannister', 'Joffrey Baratheon', 'Cersei Lannister', 'Lord Varys', 'Grand Maester Pycelle']"
46,8,46,joffrey,My father won the real war He killed Prince Rhaegar He took the crown while you hid under Casterly Rock,"['Tyrion Lannister', 'Tywin Lannister', 'Joffrey Baratheon', 'Cersei Lannister', 'Lord Varys', 'Grand Maester Pycelle']"
47,8,47,tywin,The king is tired See him to his chambers,"['Tyrion Lannister', 'Tywin Lannister', 'Joffrey Baratheon', 'Cersei Lannister', 'Lord Varys', 'Grand Maester Pycelle']"
48,8,48,cersei,Come along,"['Tyrion Lannister', 'Tywin Lannister', 'Joffrey Baratheon', 'Cersei Lannister', 'Lord Varys', 'Grand Maester Pycelle']"
49,8,49,joffrey,Im not tired,"['Tyrion Lannister', 'Tywin Lannister', 'Joffrey Baratheon', 'Cersei Lannister', 'Lord Varys', 'Grand Maester Pycelle']"
50,8,50,cersei,We have so much to celebrate A wedding to plan You must rest,"['Tyrion Lannister', 'Tywin Lannister', 'Joffrey Baratheon', 'Cersei Lannister', 'Lord Varys', 'Grand Maester Pycelle']"
51,8,51,tywin,"Grand Maester, perhaps some essence of nightshade to help him sleep","['Tyrion Lannister', 'Tywin Lannister', 'Joffrey Baratheon', 'Cersei Lannister', 'Lord Varys', 'Grand Maester Pycelle']"
52,8,52,joffrey,Im not tired,"['Tyrion Lannister', 'Tywin Lannister', 'Joffrey Baratheon', 'Cersei Lannister', 'Lord Varys', 'Grand Maester Pycelle']"
53,8,53,cersei,Come,"['Tyrion Lannister', 'Tywin Lannister', 'Joffrey Baratheon', 'Cersei Lannister', 'Lord Varys', 'Grand Maester Pycelle']"
54,9,54,tywin,Not you,"['Tyrion Lannister', 'Tywin Lannister', 'Lord Varys']"
55,9,55,tyrion,You just sent the most powerful man in Westeros to bed without his supper,"['Tyrion Lannister', 'Tywin Lannister', 'Lord Varys']"
56,9,56,tywin,Youre a fool if you believe hes the most powerful man in Westeros,"['Tyrion Lannister', 'Tywin Lannister', 'Lord Varys']"
57,10,57,tyrion,A treasonous statement Joffrey is king,"['Tyrion Lannister', 'Tywin Lannister']"
58,10,58,tywin,You really think a crown gives you power?,"['Tyrion Lannister', 'Tywin Lannister']"
59,10,59,tyrion,No I think armies give you power,"['Tyrion Lannister', 'Tywin Lannister']"
60,10,60,tywin,Mm-hmm,"['Tyrion Lannister', 'Tywin Lannister']"
61,10,61,tyrion,"Robb Stark had one, never lost a battle, and you defeated him all the same","['Tyrion Lannister', 'Tywin Lannister']"
62,10,62,tywin,Mm-hmm,"['Tyrion Lannister', 'Tywin Lannister']"
63,10,63,tyrion,"Oh, I know Walder Frey gets all the credit Or the blame, I suppose, depending on your allegiance Walder Frey is many things, but a brave man? No He never would have risked such an action if he didnt have certain assurances","['Tyrion Lannister', 'Tywin Lannister']"
64,10,64,tywin,Which he got from me Do you disapprove?,"['Tyrion Lannister', 'Tywin Lannister']"
65,10,65,tyrion,Im all for cheating This is war,"['Tyrion Lannister', 'Tywin Lannister']"
66,10,66,tywin,"But to slaughter them at a wedding Explain to me why it is more noble to kill 10,000 men in battle than a dozen at dinner","['Tyrion Lannister', 'Tywin Lannister']"
67,10,67,tyrion,So thats why you did it? To save lives?,"['Tyrion Lannister', 'Tywin Lannister']"
68,10,68,tywin,"To end the war To protect the family Do you want to write a song for the dead Starks? Go ahead, write one Im in this world a little while longer to defend the Lannisters, to defend my blood","['Tyrion Lannister', 'Tywin Lannister']"
69,10,69,tyrion,The northerners will never forget,"['Tyrion Lannister', 'Tywin Lannister']"
70,10,70,tywin,Good Let them remember what happens when they march on the south All the Stark men are dead Winterfell is a ruin Roose Bolton will be named Warden of the North until your son by Sansa comes of age,"['Tyrion Lannister', 'Tywin Lannister']"
71,10,71,tywin,I believe you still have some work to do on that score,"['Tyrion Lannister', 'Tywin Lannister']"
72,10,72,tyrion,Do you think shell open her legs for me after I tell her how we murdered her mother and brother?,"['Tyrion Lannister', 'Tywin Lannister']"
73,10,73,tywin,"One way or another, you will get that girl pregnant","['Tyrion Lannister', 'Tywin Lannister']"
74,10,74,tyrion,I will not rape her,"['Tyrion Lannister', 'Tywin Lannister']"
75,10,75,tywin,Shall I explain to you in one easy lesson how the world works?,"['Tyrion Lannister', 'Tywin Lannister']"
76,10,76,tyrion,Use small words Im not as bright as you,"['Tyrion Lannister', 'Tywin Lannister']"
77,10,77,tywin,The house that puts family first will always defeat the house that puts the whims and wishes of its sons and daughters first A good man does everything in his power to better his familys position regardless of his own selfish desires,"['Tyrion Lannister', 'Tywin Lannister']"
78,10,78,tywin,Does that amuse you?,"['Tyrion Lannister', 'Tywin Lannister']"
79,10,79,tyrion,"No, its a very good lesson Only its easy for you to preach utter devotion to family when youre making all the decisions","['Tyrion Lannister', 'Tywin Lannister']"
80,10,80,tywin,"Easy for me, is it?","['Tyrion Lannister', 'Tywin Lannister']"
81,10,81,tyrion,When have you ever done something that wasnt in your interest but solely for the benefit of the family?,"['Tyrion Lannister', 'Tywin Lannister']"
82,10,82,tywin,"The day that you were born I wanted to carry you into the sea and let the waves wash you away Instead, I let you live And I brought you as my son Because youre a Lannister","['Tyrion Lannister', 'Tywin Lannister']"
83,10,83,tyrion,Sansa,"['Tyrion Lannister', 'Tywin Lannister']"
84,12,84,meera,Its empty,"['Meera Reed', 'Jojen Reed', 'Hodor', 'Bran Stark', 'Summer']"
85,12,85,jojen,Lets find a place to sleep,"['Meera Reed', 'Jojen Reed', 'Hodor', 'Bran Stark', 'Summer']"
86,13,86,hodor,Hodor Hodor,"['Meera Reed', 'Jojen Reed', 'Hodor', 'Bran Stark', 'Summer']"
87,13,87,bran,"Dont, Hodor","['Meera Reed', 'Jojen Reed', 'Hodor', 'Bran Stark', 'Summer']"
88,13,88,bran,Maybe we shouldnt stay,"['Meera Reed', 'Jojen Reed', 'Hodor', 'Bran Stark', 'Summer']"
89,13,89,meera,Youd rather be out there?,"['Meera Reed', 'Jojen Reed', 'Hodor', 'Bran Stark', 'Summer']"
90,13,90,bran,There are a lot of stories about this place Horrible stories,"['Meera Reed', 'Jojen Reed', 'Hodor', 'Bran Stark', 'Summer']"
91,13,91,jojen,I always quite liked the horrible stories,"['Meera Reed', 'Jojen Reed', 'Hodor', 'Bran Stark', 'Summer']"
92,13,92,bran,So did I Once,"['Meera Reed', 'Jojen Reed', 'Hodor', 'Bran Stark', 'Summer']"
93,13,93,bran,You ever heard about the Rat Cook?,"['Meera Reed', 'Jojen Reed', 'Hodor', 'Bran Stark', 'Summer']"
94,13,94,meera,No Whos he?,"['Meera Reed', 'Jojen Reed', 'Hodor', 'Bran Stark', 'Summer']"
95,13,95,bran,"Just a cook in the Nights Watch He was angry at the king for something, I dont remember When the king was visiting the Nightfort, the cook killed the kings son, cooked him into a big pie with onions, carrots, mushrooms and bacon That night he served the pie to the king He liked the taste of his son so much, he asked for a second slice The gods turned the cook into a giant white rat who could only eat his own young Hes been roaming the Nightfort ever since, devouring his own babies But no matter what he does, hes always hungry","['Meera Reed', 'Jojen Reed', 'Hodor', 'Bran Stark', 'Summer']"
96,13,96,meera,If the gods turned every killer into a giant white rat-,"['Meera Reed', 'Jojen Reed', 'Hodor', 'Bran Stark', 'Summer']"
97,13,97,bran,It wasnt for murder the gods cursed the Rat Cook or for serving the kings son in a pie He killed a guest beneath his roof Thats something the gods cant forgive,"['Meera Reed', 'Jojen Reed', 'Hodor', 'Bran Stark', 'Summer']"
98,14,98,walder,"The late Walder Frey, old Hoster called me because I didnt get my men to the Trident in time for battle He thought he was witty Look at us now, Tully Youre dead, your daughter-Catelyns dead, your grandsons dead, your son spent his wedding night in a dungeon and Im Lord of Riverrun","['Walder Frey', 'Roose Bolton']"
99,14,99,roose bolton,The Blackfish escaped,"['Walder Frey', 'Roose Bolton']"
100,14,100,walder,An old man on the run with no allies I have Tywin Lannister backing me Who does he have?,"['Walder Frey', 'Roose Bolton']"
101,14,101,roose bolton,As you say,"['Walder Frey', 'Roose Bolton']"
102,14,102,walder,"They all laughed at me, all those high lords They all thought they were better than me Ned Stark, Hoster Tully People snigger when I marry a young girl, but who said a word when Jon Arryn married the little Tully bitch?","['Walder Frey', 'Roose Bolton']"
103,14,103,roose bolton,Youll be needing a new young girl,"['Walder Frey', 'Roose Bolton']"
104,14,104,walder,Yeah Got that to look forward to,"['Walder Frey', 'Roose Bolton']"
105,14,105,walder,"And you, the Warden of the North No more Starks to bow and scrape to Must have been torture following that stupid boy all over the country","['Walder Frey', 'Roose Bolton']"
106,14,106,roose bolton,He ignored my advice at every turn If hed been a trifle less arrogant-,"['Walder Frey', 'Roose Bolton']"
107,14,107,walder,Calling himself the Young Wolf Hows that for pomposity?,"['Walder Frey', 'Roose Bolton']"
108,14,108,walder,"Well, heres to the Young Wolf","['Walder Frey', 'Roose Bolton']"
109,14,109,roose bolton,Forever young,"['Walder Frey', 'Roose Bolton']"
110,14,110,walder,Will you move to Winterfell now that the wars over?,"['Walder Frey', 'Roose Bolton']"
111,14,111,roose bolton,At some point perhaps But Winterfells in ruins,"['Walder Frey', 'Roose Bolton']"
112,14,112,walder,"Yeah What happened up there? I heard the Greyjoy boy seized the place I heard he killed all the ravens And after that, nothing","['Walder Frey', 'Roose Bolton']"
113,14,113,roose bolton,I sent my bastard Ramsay to root him out Robb Stark offered amnesty for the ironborn if they gave us Theon,"['Walder Frey', 'Roose Bolton']"
114,14,114,walder,Oh And?,"['Walder Frey', 'Roose Bolton']"
115,15,115,ramsay,"Well, the girls werent lying You had a good-sized cock","['Ramsay Snow', 'Theon Greyjoy']"
116,15,116,ramsay,What? No Pork sausage You think Im some sort of savage?,"['Ramsay Snow', 'Theon Greyjoy']"
117,15,117,ramsay,People talk about phantom limbs An amputee might have an itch where his foot used to be So Ive always wondered do eunuchs have a phantom cock?,"['Ramsay Snow', 'Theon Greyjoy']"
118,15,118,ramsay,"Next time you think about naked girls, would you feel an itch?","['Ramsay Snow', 'Theon Greyjoy']"
119,15,119,ramsay,Sorry I shouldnt make jokes My mother taught me not to throw stones at cripples,"['Ramsay Snow', 'Theon Greyjoy']"
120,15,120,ramsay,But my father taught me to aim for their head,"['Ramsay Snow', 'Theon Greyjoy']"
121,15,121,theon,Kill me,"['Ramsay Snow', 'Theon Greyjoy']"
122,15,122,ramsay,"Sorry, what?","['Ramsay Snow', 'Theon Greyjoy']"
123,15,123,theon,Kill me,"['Ramsay Snow', 'Theon Greyjoy']"
124,15,124,ramsay,A little louder,"['Ramsay Snow', 'Theon Greyjoy']"
125,15,125,theon,Kill me,"['Ramsay Snow', 'Theon Greyjoy']"
126,15,126,ramsay,Youre no good to me dead We need you,"['Ramsay Snow', 'Theon Greyjoy']"
127,15,127,ramsay,"You dont look like a Theon Greyjoy anymore Thats a name for a lord But youre not a lord, are you? Youre just meat","['Ramsay Snow', 'Theon Greyjoy']"
128,15,128,ramsay,Stinking meat,"['Ramsay Snow', 'Theon Greyjoy']"
129,15,129,ramsay,You reek Reek! Thats a good name for you Whats your name?,"['Ramsay Snow', 'Theon Greyjoy']"
130,15,130,theon,Theon Greyjoy,"['Ramsay Snow', 'Theon Greyjoy']"
131,15,131,ramsay,Whats your name?,"['Ramsay Snow', 'Theon Greyjoy']"
132,15,132,theon,Th Theon Greyjoy,"['Ramsay Snow', 'Theon Greyjoy']"
133,15,133,theon,Please,"['Ramsay Snow', 'Theon Greyjoy']"
134,15,134,ramsay,What is your name?,"['Ramsay Snow', 'Theon Greyjoy']"
135,15,135,theon,Reek My name is Reek,"['Ramsay Snow', 'Theon Greyjoy']"
136,16,136,bran,Hodor,"['Bran Stark', 'Summer', 'Hodor', 'Meera Reed', 'Jojen Reed']"
137,16,137,sam,Dont kill me,"['Bran Stark', 'Summer', 'Hodor', 'Meera Reed', 'Jojen Reed']"
138,16,138,meera,Who are you?,"['Bran Stark', 'Summer', 'Hodor', 'Meera Reed', 'Jojen Reed']"
139,17,139,gilly,Sam! Sam,"['Bran Stark', 'Summer', 'Hodor', 'Meera Reed', 'Jojen Reed', 'Samwell Tarly', 'Gilly', 'Baby Sam']"
140,17,140,meera,Who are you?,"['Bran Stark', 'Summer', 'Hodor', 'Meera Reed', 'Jojen Reed', 'Samwell Tarly', 'Gilly', 'Baby Sam']"
141,17,141,gilly,Gilly Dont hurt us,"['Bran Stark', 'Summer', 'Hodor', 'Meera Reed', 'Jojen Reed', 'Samwell Tarly', 'Gilly', 'Baby Sam']"
142,17,142,jojen,Where are you going?,"['Bran Stark', 'Summer', 'Hodor', 'Meera Reed', 'Jojen Reed', 'Samwell Tarly', 'Gilly', 'Baby Sam']"
143,17,143,sam,To Castle Black Im a brother of the Nights Watch,"['Bran Stark', 'Summer', 'Hodor', 'Meera Reed', 'Jojen Reed', 'Samwell Tarly', 'Gilly', 'Baby Sam']"
144,17,144,bran,"My brother, hes in the Nights-","['Bran Stark', 'Summer', 'Hodor', 'Meera Reed', 'Jojen Reed', 'Samwell Tarly', 'Gilly', 'Baby Sam']"
145,17,145,jojen,Shush,"['Bran Stark', 'Summer', 'Hodor', 'Meera Reed', 'Jojen Reed', 'Samwell Tarly', 'Gilly', 'Baby Sam']"
146,17,146,sam,Whos your brother?,"['Bran Stark', 'Summer', 'Hodor', 'Meera Reed', 'Jojen Reed', 'Samwell Tarly', 'Gilly', 'Baby Sam']"
147,17,147,jojen,Doesnt matter,"['Bran Stark', 'Summer', 'Hodor', 'Meera Reed', 'Jojen Reed', 'Samwell Tarly', 'Gilly', 'Baby Sam']"
148,17,148,sam,Youre Jons brother The one who fell from the window,"['Bran Stark', 'Summer', 'Hodor', 'Meera Reed', 'Jojen Reed', 'Samwell Tarly', 'Gilly', 'Baby Sam']"
149,17,149,bran,"No, Im not","['Bran Stark', 'Summer', 'Hodor', 'Meera Reed', 'Jojen Reed', 'Samwell Tarly', 'Gilly', 'Baby Sam']"
150,17,150,sam,Ive been around Ghost enough to know a direwolf when I see one And Ive heard all about Hodor,"['Bran Stark', 'Summer', 'Hodor', 'Meera Reed', 'Jojen Reed', 'Samwell Tarly', 'Gilly', 'Baby Sam']"
151,17,151,hodor,Hodor,"['Bran Stark', 'Summer', 'Hodor', 'Meera Reed', 'Jojen Reed', 'Samwell Tarly', 'Gilly', 'Baby Sam']"
152,17,152,sam,"Id be dead if it wasnt for Jon If youre his brother, youre my brother, too And anything I can do to help you, I will","['Bran Stark', 'Summer', 'Hodor', 'Meera Reed', 'Jojen Reed', 'Samwell Tarly', 'Gilly', 'Baby Sam']"
153,17,153,bran,Take us north of the Wall,"['Bran Stark', 'Summer', 'Hodor', 'Meera Reed', 'Jojen Reed', 'Samwell Tarly', 'Gilly', 'Baby Sam']"
154,17,154,sam,What? Why in the world would you want to go-,"['Bran Stark', 'Summer', 'Hodor', 'Meera Reed', 'Jojen Reed', 'Samwell Tarly', 'Gilly', 'Baby Sam']"
155,17,155,bran,I dont want to I have to,"['Bran Stark', 'Summer', 'Hodor', 'Meera Reed', 'Jojen Reed', 'Samwell Tarly', 'Gilly', 'Baby Sam']"
156,17,156,jojen,How did you get through the Wall?,"['Bran Stark', 'Summer', 'Hodor', 'Meera Reed', 'Jojen Reed', 'Samwell Tarly', 'Gilly', 'Baby Sam']"
157,17,157,meera,Does the well lead to an underground river? Is that how you came here?,"['Bran Stark', 'Summer', 'Hodor', 'Meera Reed', 'Jojen Reed', 'Samwell Tarly', 'Gilly', 'Baby Sam']"
158,17,158,sam,Come with us There are steps carved into the south side of the Wall Hodor can carry you to the top Well walk straight to Castle Black,"['Bran Stark', 'Summer', 'Hodor', 'Meera Reed', 'Jojen Reed', 'Samwell Tarly', 'Gilly', 'Baby Sam']"
159,17,159,gilly,Come with us Theres nothing north but death,"['Bran Stark', 'Summer', 'Hodor', 'Meera Reed', 'Jojen Reed', 'Samwell Tarly', 'Gilly', 'Baby Sam']"
160,17,160,sam,"If Jon is alive, then Castle Blacks where hell be Its the safest place for you","['Bran Stark', 'Summer', 'Hodor', 'Meera Reed', 'Jojen Reed', 'Samwell Tarly', 'Gilly', 'Baby Sam']"
161,17,161,jojen,Theres nowhere safe any longer You know that,"['Bran Stark', 'Summer', 'Hodor', 'Meera Reed', 'Jojen Reed', 'Samwell Tarly', 'Gilly', 'Baby Sam']"
162,17,162,sam,"What I know is what I saw And if you saw it, too, youd run the other way","['Bran Stark', 'Summer', 'Hodor', 'Meera Reed', 'Jojen Reed', 'Samwell Tarly', 'Gilly', 'Baby Sam']"
163,17,163,jojen,You saw the white walkers and the army of the dead,"['Bran Stark', 'Summer', 'Hodor', 'Meera Reed', 'Jojen Reed', 'Samwell Tarly', 'Gilly', 'Baby Sam']"
164,17,164,sam,How do you know all that?,"['Bran Stark', 'Summer', 'Hodor', 'Meera Reed', 'Jojen Reed', 'Samwell Tarly', 'Gilly', 'Baby Sam']"
165,17,165,jojen,The Nights Watch cant stop them The kings of Westeros and all their armies cant stop them,"['Bran Stark', 'Summer', 'Hodor', 'Meera Reed', 'Jojen Reed', 'Samwell Tarly', 'Gilly', 'Baby Sam']"
166,17,166,sam,But youre going to stop them?,"['Bran Stark', 'Summer', 'Hodor', 'Meera Reed', 'Jojen Reed', 'Samwell Tarly', 'Gilly', 'Baby Sam']"
167,17,167,bran,"Please, Sam I have to go north I have to","['Bran Stark', 'Summer', 'Hodor', 'Meera Reed', 'Jojen Reed', 'Samwell Tarly', 'Gilly', 'Baby Sam']"
168,19,168,balon,"Balon Greyjoy, Lord of the Iron Islands and invader of the North I give you until the full moon to order all ironborn scum out of the North and back to those shit-stained rocks you call a home","['Balon Greyjoy', 'Yara Greyjoy']"
169,19,169,balon,"On the first night of the full moon, I will hunt down every islander still in our lands and flay them living the way I flayed the 20 ironborn scum I found at Winterfell In the box youll find a special gift Theons favorite toy He cried when I took it away from him","['Balon Greyjoy', 'Yara Greyjoy']"
170,19,170,balon,"Leave the North now or more boxes will follow with more Theon Signed Ramsay Snow, natural-born son of Roose Bolton, Lord of the Dreadfort and Warden of the North Get that out of my sight","['Balon Greyjoy', 'Yara Greyjoy']"
171,19,171,balon,Theon disobeyed my orders,"['Balon Greyjoy', 'Yara Greyjoy']"
172,19,172,balon,"The boy is a fool He cannot further the Greyjoy line I will not give up the lands I have seized, the strongholds I have taken Get this away from me","['Balon Greyjoy', 'Yara Greyjoy']"
173,19,173,yara,Hes your son,"['Balon Greyjoy', 'Yara Greyjoy']"
174,19,174,balon,Son? Hes not a man anymore,"['Balon Greyjoy', 'Yara Greyjoy']"
175,19,175,yara,Hes your son Hes my brother Hes a Greyjoy,"['Balon Greyjoy', 'Yara Greyjoy']"
176,19,176,balon,Watch yourself Ive made my decision,"['Balon Greyjoy', 'Yara Greyjoy']"
177,19,177,yara,And Ive made mine Im going to pick the fastest ship in our fleet,"['Balon Greyjoy', 'Yara Greyjoy']"
178,20,178,yara,Im going to choose the 50 best killers on the Iron Islands,['Yara Greyjoy']
179,20,179,man,Get those ropes,['Yara Greyjoy']
180,20,180,yara,Im going to sail up the Narrow Sea all the way to the Weeping Water Im going to march on the Dreadfort Im going to find my little brother and Im going to bring him home,['Yara Greyjoy']
181,20,181,bran,What is it?,['Yara Greyjoy']
182,20,182,jojen,Dragonglass,['Yara Greyjoy']
183,21,183,sam,We found them at the Fist Someone buried them a long time ago Someone wanted us to find them,"['Bran Stark', 'Hodor', 'Meera Reed', 'Jojen Reed', 'Samwell Tarly', 'Gilly', 'Baby Sam', 'Summer']"
184,21,184,bran,Why? What are they for?,"['Bran Stark', 'Hodor', 'Meera Reed', 'Jojen Reed', 'Samwell Tarly', 'Gilly', 'Baby Sam', 'Summer']"
