,0,1,2,3,4
355,23,355,loras,"I am My father could be your bank Ive never fought in a war before, but Id fight for you","['Renly Baratheon', 'Loras Tyrell']"
356,23,356,renly,Im fourth in line,"['Renly Baratheon', 'Loras Tyrell']"
357,23,357,loras,And where was Robert in the line of royal succession? Joffrey is a monster Tommen is eight,"['Renly Baratheon', 'Loras Tyrell']"
358,23,358,renly,Stannis?,"['Renly Baratheon', 'Loras Tyrell']"
359,23,359,loras,Stannis has the personality of a lobster,"['Renly Baratheon', 'Loras Tyrell']"
360,23,360,renly,Hes still my older brother,"['Renly Baratheon', 'Loras Tyrell']"
361,23,361,renly,What are you doing?,"['Renly Baratheon', 'Loras Tyrell']"
362,23,362,loras,Look at it,"['Renly Baratheon', 'Loras Tyrell']"
363,23,363,renly,You cut me,"['Renly Baratheon', 'Loras Tyrell']"
364,23,364,loras,"Its just blood Weve all got it in us Sometimes a little spills If you become King, youre going to see a lot of this You need to get used to it Go on Look People love you They love to serve you because youre kind to them They want to be near you","['Renly Baratheon', 'Loras Tyrell']"
365,23,365,loras,"Youre willing to do what needs to be done, but you dont gloat over it You dont love killing Where is it written that power is the sole province of the worst? That thrones are only made for the hated and the feared You would be a wonderful King -","['Renly Baratheon', 'Loras Tyrell']"
366,24,366,cersei,Im sorry your marriage to Ned Stark didnt work out You seemed so good together,"['Robert Baratheon', 'Cersei Lannister']"
367,24,367,robert,Im glad I could do something to make you happy,"['Robert Baratheon', 'Cersei Lannister']"
368,24,368,cersei,"Without a Hand, everything will fall to pieces","['Robert Baratheon', 'Cersei Lannister']"
369,24,369,robert,I suppose this is where you tell me to give the job to your brother Jaime,"['Robert Baratheon', 'Cersei Lannister']"
370,24,370,cersei,No Hes not serious enough Ill say this for Ned Stark hes serious enough Was it really worth it? Losing him this way?,"['Robert Baratheon', 'Cersei Lannister']"
371,24,371,robert,"I dont know But I do know this, if the Targaryen girl convinces her horse-lord husband to invade and the Dothraki horde crosses The Narrow Sea We wont be able to stop them","['Robert Baratheon', 'Cersei Lannister']"
372,24,372,cersei,The Dothraki dont sail Every child knows that They dont have discipline They dont have armor They dont have siege weapons,"['Robert Baratheon', 'Cersei Lannister']"
373,24,373,robert,"Its a neat little trick you do, you move your lips and your fathers voice comes out","['Robert Baratheon', 'Cersei Lannister']"
374,24,374,cersei,Is my father wrong?,"['Robert Baratheon', 'Cersei Lannister']"
375,24,375,robert,"Lets say Viserys Targaryen lands with forty thousand Dothraki screamers at his back We hole up in our castles, a wise move Only a fool would meet the Dothraki in an open field They leave us in our castles They go from town to town, looting and burning, killing every man who cant hide behind a stone wall, stealing all our crops and livestock, enslaving all our women and children How long do the people of the Seven Kingdoms stand behind their absentee King, their cowardly King hiding behind high walls? When do the people decide that Viserys Targaryen is the rightful monarch after all","['Robert Baratheon', 'Cersei Lannister']"
376,24,376,cersei,We still outnumber them,"['Robert Baratheon', 'Cersei Lannister']"
377,24,377,robert,Which is the bigger number five or one?,"['Robert Baratheon', 'Cersei Lannister']"
378,24,378,cersei,Five,"['Robert Baratheon', 'Cersei Lannister']"
379,24,379,robert,"Five one One army, a real army, united behind one leader with one purpose Our purpose died with the Mad King Now weve got as many armies as there are men with gold in their purse And everybody wants something different Your father wants to own the world Ned Stark wants to run away and bury his head in the snow","['Robert Baratheon', 'Cersei Lannister']"
380,24,380,cersei,What do you want?,"['Robert Baratheon', 'Cersei Lannister']"
381,24,381,robert,"We havent had a real fight in nine years Back-stabbing doesnt prepare you for a fight And thats all the realm is now, back-stabbing and scheming and arse-licking and money-grubbing Sometimes I dont know what holds it together","['Robert Baratheon', 'Cersei Lannister']"
382,24,382,cersei,Our marriage,"['Robert Baratheon', 'Cersei Lannister']"
383,24,383,robert,"Ah, so here we sit, seventeen years later, holding it all together Dont you get tired?","['Robert Baratheon', 'Cersei Lannister']"
384,24,384,cersei,Every day,"['Robert Baratheon', 'Cersei Lannister']"
385,24,385,robert,How long can hate hold a thing together?,"['Robert Baratheon', 'Cersei Lannister']"
386,24,386,cersei,"Well, seventeen years is quite a long time","['Robert Baratheon', 'Cersei Lannister']"
387,24,387,robert,"Yes, it is","['Robert Baratheon', 'Cersei Lannister']"
388,24,388,cersei,"Yes, it tis What was she like?","['Robert Baratheon', 'Cersei Lannister']"
389,24,389,robert,"Youve never asked about her, not once Why not?","['Robert Baratheon', 'Cersei Lannister']"
390,24,390,cersei,"At first, just saying her name, even in private felt like I was breathing life back into her I thought if I didnt talk about her, shed just fade away for you When I realized that wasnt going to happen, I refused to ask out of spite I didnt want to give you the satisfaction of thinking I cared enough to ask And eventually it became clear that my spite didnt mean anything to you, as far as I could tell, you actually enjoyed it","['Robert Baratheon', 'Cersei Lannister']"
391,24,391,robert,So why now?,"['Robert Baratheon', 'Cersei Lannister']"
392,24,392,cersei,What harm could Lyanna Starks ghost do to either of us that we havent done to each other a hundred times over?,"['Robert Baratheon', 'Cersei Lannister']"
393,24,393,robert,"You want to know the horrible truth? I cant even remember what she looked like I only know she was the one thing I ever wanted Someone took her away from me, and Seven Kingdoms couldnt fill the hole she left behind","['Robert Baratheon', 'Cersei Lannister']"
394,24,394,cersei,"I felt something for you once, you know?","['Robert Baratheon', 'Cersei Lannister']"
395,24,395,robert,I know,"['Robert Baratheon', 'Cersei Lannister']"
396,24,396,cersei,"Even after we lost our first boy for quite a while, actually Was it ever possible for us? Was there ever a time, ever a moment?","['Robert Baratheon', 'Cersei Lannister']"
397,24,397,robert,No Does that make you feel better or worse?,"['Robert Baratheon', 'Cersei Lannister']"
398,24,398,cersei,It doesnt make me feel anything -,"['Robert Baratheon', 'Cersei Lannister']"
399,25,399,mhaegen,"She looks like him, dont she, my Lord? She has his nose, his black hair","['Eddard Stark', 'Mhaegen']"
400,25,400,ned,Aye,"['Eddard Stark', 'Mhaegen']"
401,25,401,mhaegen,"Tell him when you see him, my Lord If it please you Tell him how beautiful she is","['Eddard Stark', 'Mhaegen']"
402,25,402,ned,I will,"['Eddard Stark', 'Mhaegen']"
403,25,403,mhaegen,"And tell him Ive been with no one else I swear it, my Lord, by the old gods and new I dont want no jewels or nothing, just him ing was always good to me","['Eddard Stark', 'Mhaegen']"
404,25,404,ned,"When Jon Arryn came to visit you, what did he want?","['Eddard Stark', 'Mhaegen']"
405,25,405,mhaegen,"He wasnt that sort of man, my Lord He just wanted to know if the child was happy, healthy","['Eddard Stark', 'Mhaegen']"
406,25,406,ned,She looks healthy enough to me The girl shall want for nothing,"['Eddard Stark', 'Mhaegen']"
407,26,407,littlefinger,"Brothels make a much better investment than ship, Ive found Whores rarely sink","['Eddard Stark', 'Petyr Baelish', 'Jory Cassel']"
408,26,408,ned,What do you know of King Roberts bastards?,"['Eddard Stark', 'Petyr Baelish', 'Jory Cassel']"
409,26,409,littlefinger,"Well, he has more than you, for a start","['Eddard Stark', 'Petyr Baelish', 'Jory Cassel']"
410,26,410,ned,How many?,"['Eddard Stark', 'Petyr Baelish', 'Jory Cassel']"
411,26,411,littlefinger,"Does it matter? If you fuck enough women, some of them will give you presents","['Eddard Stark', 'Petyr Baelish', 'Jory Cassel']"
412,26,412,ned,And Jon Arryn tracked them all down Why?,"['Eddard Stark', 'Petyr Baelish', 'Jory Cassel']"
413,26,413,littlefinger,He was the Kings Hand Perhaps Robert wanted them looked after He was overcome with fatherly love,"['Eddard Stark', 'Petyr Baelish', 'Jory Cassel']"
414,26,414,ned,Come,"['Eddard Stark', 'Petyr Baelish', 'Jory Cassel']"
415,26,415,ned,Jory,"['Eddard Stark', 'Petyr Baelish', 'Jory Cassel']"
416,26,416,jory cassel,My Lord,"['Eddard Stark', 'Petyr Baelish', 'Jory Cassel']"
417,27,417,jaime,Such a small pack of wolves,"['Eddard Stark', 'Jory Cassel', 'Jaime Lannister', 'Petyr Baelish']"
418,27,418,jory cassel,"Stay back, Ser! This is the Hand of the King","['Eddard Stark', 'Jory Cassel', 'Jaime Lannister', 'Petyr Baelish']"
419,27,419,jaime,Was! the Hand of the King Now Im not sure what he is Lord of somewhere very far away,"['Eddard Stark', 'Jory Cassel', 'Jaime Lannister', 'Petyr Baelish']"
420,27,420,littlefinger,"Whats the meaning of this, Lannister?","['Eddard Stark', 'Jory Cassel', 'Jaime Lannister', 'Petyr Baelish']"
421,27,421,jaime,"Get back inside where its safe Im looking for my brother You remember my brother, dont you, Lord Stark? Blond hair, sharp tongue, short man","['Eddard Stark', 'Jory Cassel', 'Jaime Lannister', 'Petyr Baelish']"
422,27,422,ned,I remember him well,"['Eddard Stark', 'Jory Cassel', 'Jaime Lannister', 'Petyr Baelish']"
423,27,423,jaime,"It seems he had some trouble on the road You wouldnt know what happened to him, would you?","['Eddard Stark', 'Jory Cassel', 'Jaime Lannister', 'Petyr Baelish']"
424,27,424,ned,He was taken at my command to answer for his crimes,"['Eddard Stark', 'Jory Cassel', 'Jaime Lannister', 'Petyr Baelish']"
425,27,425,littlefinger,My Lords! Ill bring the City Watch,"['Eddard Stark', 'Jory Cassel', 'Jaime Lannister', 'Petyr Baelish']"
426,27,426,jaime,"Come, Stark Id rather you die sword in hand","['Eddard Stark', 'Jory Cassel', 'Jaime Lannister', 'Petyr Baelish']"
427,27,427,jory cassel,If you threaten my Lord again.,"['Eddard Stark', 'Jory Cassel', 'Jaime Lannister', 'Petyr Baelish']"
428,27,428,jaime,"Threaten? As in, Im going to open your Lord from balls to brains and see what Starks are made of'?","['Eddard Stark', 'Jory Cassel', 'Jaime Lannister', 'Petyr Baelish']"
429,27,429,ned,"You kill me, your brothers a dead man","['Eddard Stark', 'Jory Cassel', 'Jaime Lannister', 'Petyr Baelish']"
430,27,430,jaime,Youre right Take him alive! Kill his men,"['Eddard Stark', 'Jory Cassel', 'Jaime Lannister', 'Petyr Baelish']"
