1;00:03:05,000;00:03:17,000;www.addic7ed.com
2;00:03:32,872;00:03:35,953;Summoned to court to answer for
2;00:03:32,872;00:03:35,953;the crime of your bannerman,
3;00:03:35,954;00:03:37,834;Gregor Clegane, The Mountain.
4;00:03:39,184;00:03:43,287;Arrive within a fortnight
4;00:03:39,184;00:03:43,287;or be branded an enemy of the crown.
5;00:03:45,261;00:03:49,250;Poor Ned Stark. Brave man,
5;00:03:45,261;00:03:49,250;terrible judgment.
6;00:03:53,829;00:03:56,025;Attacking him was stupid.
7;00:04:04,451;00:04:05,914;Lannister...
8;00:04:06,950;00:04:08,912;don't act like fools.
9;00:04:14,639;00:04:17,177;You're gonna say
9;00:04:14,639;00:04:17,177;something clever?
10;00:04:18,265;00:04:20,326;Go on, say something clever.
11;00:04:23,764;00:04:25,876;Catelyn Stark took my brother.
12;00:04:29,828;00:04:31,440;Why is he still alive?
13;00:04:31,579;00:04:32,664;Tyrion?
14;00:04:32,830;00:04:34,226;Ned Stark.
15;00:04:35,455;00:04:37,366;One of our men interfered...
16;00:04:37,467;00:04:40,777;speared him through the leg,
16;00:04:37,467;00:04:40,777;before I could finish him.
17;00:04:41,452;00:04:43,337;Why is he still alive?
18;00:04:44,516;00:04:46,630;It wouldn't have been clean.
19;00:04:46,789;00:04:47,953;Clean?
20;00:04:49,642;00:04:53,429;You spent too much time
20;00:04:49,642;00:04:53,429;worrying about what other people think of you.
21;00:04:53,480;00:04:55,828;I could care less what
21;00:04:53,480;00:04:55,828;what anyone thinks of me.
22;00:04:55,866;00:04:58,601;That's what you want people
22;00:04:55,866;00:04:58,601;to think of you.
23;00:04:58,641;00:05:00,054;It's the truth.
24;00:05:01,456;00:05:06,129;And you hear them whispering Kingslayer
24;00:05:01,456;00:05:06,129;behind your back, doesn't it bother you?
25;00:05:08,267;00:05:10,477;Of course it bothers me.
26;00:05:10,830;00:05:14,667;A lion doesn't concern himself
26;00:05:10,830;00:05:14,667;with the opinion of a sheep.
27;00:05:17,604;00:05:19,955;I suppose I should be grateful
27;00:05:17,604;00:05:19,955;that your vanity,
28;00:05:19,956;00:05:22,606;got in a way of your recklessness.
29;00:05:24,579;00:05:28,480;I'm giving you half of our forces.
29;00:05:24,579;00:05:28,480;30.000 men.
30;00:05:29,328;00:05:32,422;And we'll bring that to
30;00:05:29,328;00:05:32,422;Catelyn Stark girlhood home...
31;00:05:32,639;00:05:36,542;and remind her that Lannisters
31;00:05:32,639;00:05:36,542;pay their debts
32;00:05:38,078;00:05:41,656;I didn't realize you place such
32;00:05:38,078;00:05:41,656;a high value on my brother's life.
33;00:05:41,705;00:05:43,227;He's a Lannister.
34;00:05:43,956;00:05:47,278;Maybe the lowest of the Lannister,
34;00:05:43,956;00:05:47,278;but he's one of us.
35;00:05:47,467;00:05:49,842;And every day that he remains a prisoner,
36;00:05:49,964;00:05:52,606;the less our name command respect.
37;00:05:52,952;00:05:57,478;So the lion does concern himself with the opinion...
37;00:05:52,952;00:05:57,478;No, that's not an opinion, it's a fact.
38;00:06:00,016;00:06:02,509;If another house can seize
38;00:06:00,016;00:06:02,509;one of our own
39;00:06:02,544;00:06:04,856;and hold him captive, with impunity...
40;00:06:05,357;00:06:07,992;we are no longer house to be feared.
41;00:06:12,268;00:06:13,541;Your mother is dead.
42;00:06:14,454;00:06:16,528;Before long I'll be dead.
43;00:06:16,563;00:06:17,728;and you...
44;00:06:18,266;00:06:19,290;and your brother...
45;00:06:19,578;00:06:22,167;and your sister and all of her children...
46;00:06:22,208;00:06:26,419;all of us dead,
46;00:06:22,208;00:06:26,419;all of us rotting underground.
47;00:06:27,455;00:06:30,104;Is the family name
47;00:06:27,455;00:06:30,104;that lives on.
48;00:06:30,208;00:06:32,341;It's all that lives on.
49;00:06:32,833;00:06:37,233;Not your personal glory
49;00:06:32,833;00:06:37,233;not your honor... but family.
50;00:06:38,644;00:06:40,591;You understand?
51;00:06:52,395;00:06:55,994;You're blessed with ability
51;00:06:52,395;00:06:55,994;that few men possess.
52;00:06:56,079;00:07:00,009;You're blessed you belong to
52;00:06:56,079;00:07:00,009;the most powerful family in the kingdom.
53;00:07:00,329;00:07:02,819;And you still blessed
53;00:07:00,329;00:07:02,819;with youth.
54;00:07:03,393;00:07:05,893;And what you've done
54;00:07:03,393;00:07:05,893;with this blessing?
55;00:07:07,082;00:07:10,708;You served as the glorified bodyguard
55;00:07:07,082;00:07:10,708;for two kings...
56;00:07:10,709;00:07:13,731;one a mad man, the other a drunk.
57;00:07:19,083;00:07:22,959;The future of our family will be
57;00:07:19,083;00:07:22,959;determined in these next few months.
58;00:07:22,960;00:07:26,546;We could established a dynasty
58;00:07:22,960;00:07:26,546;that would last a thousand years...
59;00:07:27,020;00:07:30,680;or we could collapse into nothing.
59;00:07:27,020;00:07:30,680;As the Targaryens did.
60;00:07:33,643;00:07:37,681;I need you to become a man
60;00:07:33,643;00:07:37,681;you're always meant to be.
61;00:07:38,252;00:07:40,627;Not next year, not tomorrow...
62;00:07:41,601;00:07:42,877;Now.
63;00:08:12,590;00:08:13,678;You're in pain.
64;00:08:20,092;00:08:21,978;I've had worse, my lady.
65;00:08:23,152;00:08:25,065;Perhaps it's time to go home.
66;00:08:25,529;00:08:27,466;The south doesn't seem to agree with you...
67;00:08:27,467;00:08:30,041;I know the truth Jon Arryn died for...
68;00:08:31,089;00:08:32,817;Do you, lord Stark?
69;00:08:33,779;00:08:37,238;Is that why you called me here?
69;00:08:33,779;00:08:37,238;To pose me riddles?
70;00:08:38,101;00:08:39,673;Has he done this before?
71;00:08:41,442;00:08:42,979;Jaime would've killed him.
72;00:08:44,279;00:08:46,690;My brother's worth
72;00:08:44,279;00:08:46,690;a thousand of your friend.
73;00:08:46,691;00:08:47,778;Your brother...
74;00:08:48,440;00:08:49,591;or your lover?
75;00:08:54,754;00:08:57,913;Targaryens wed brothers and sisters
75;00:08:54,754;00:08:57,913;for 300 years...
76;00:08:57,914;00:08:59,591;to keep bloodlines pure.
77;00:09:00,067;00:09:02,355;Jaime and I are more than
77;00:09:00,067;00:09:02,355;brother and sister.
78;00:09:02,379;00:09:04,441;We shared a womb.
79;00:09:04,442;00:09:07,444;Came to this world together,
79;00:09:04,442;00:09:07,444;we belong together.
80;00:09:08,192;00:09:10,156;My son saw you with him.
81;00:09:17,067;00:09:19,157;Do you love your children?
81;00:09:17,067;00:09:19,157;With all my heart.
82;00:09:19,192;00:09:22,335;No more than I love mine.
82;00:09:19,192;00:09:22,335;And they're all Jaime's.
83;00:09:22,395;00:09:23,609;Thank the Gods.
84;00:09:23,610;00:09:27,126;In the rare event that Robert leaves his whores
84;00:09:23,610;00:09:27,126;for long enough to stumble drunk into my bed,
85;00:09:27,127;00:09:28,950;I finished him off another ways
86;00:09:28,951;00:09:32,193;In the morning he doesn't remember.
86;00:09:28,951;00:09:32,193;You've always hated him.
87;00:09:32,343;00:09:33,549;Hated him?
88;00:09:34,098;00:09:35,567;I worshipped him.
89;00:09:35,720;00:09:39,706;Every girl in the southern kingdom
89;00:09:35,720;00:09:39,706;dreamt of him but he was mine by oath.
90;00:09:40,094;00:09:43,930;And when I finally saw him on our wedding day
90;00:09:40,094;00:09:43,930;in the Sept of Baelor.
91;00:09:44,031;00:09:48,556;lean and fierce, and black-bearded
91;00:09:44,031;00:09:48,556;it was the happiest moment of my life.
92;00:09:49,906;00:09:52,280;And that night he crawl on top of me,
92;00:09:49,906;00:09:52,280;stinking of wine
93;00:09:52,315;00:09:55,399;and did what he did what little he could do
94;00:09:57,182;00:09:59,492;and whispered in my ear: Lyanna.
95;00:10:01,530;00:10:04,240;Your sister was a corpse
95;00:10:01,530;00:10:04,240;and I was a living girl
96;00:10:04,241;00:10:06,032;and he loved her more than me.
97;00:10:08,345;00:10:11,530;When the king return from his hunts,
97;00:10:08,345;00:10:11,530;I'll tell him the truth.
98;00:10:11,531;00:10:14,657;You must be gone by then...
98;00:10:11,531;00:10:14,657;you and your children.
99;00:10:14,777;00:10:17,220;I will not have that blood on my hands.
100;00:10:17,513;00:10:19,488;Go as far away as you can...
101;00:10:20,075;00:10:22,312;With as many men as you can.
102;00:10:22,717;00:10:24,163;Because wherever you go...
103;00:10:24,951;00:10:26,914;Robert's wrath will follow you.
104;00:10:27,512;00:10:29,426;And what of my wrath, Lord Stark?
105;00:10:30,139;00:10:32,300;You should have taken the realm
105;00:10:30,139;00:10:32,300;for yourself.
106;00:10:32,515;00:10:35,589;Jaime told me about the day
106;00:10:32,515;00:10:35,589;King's Landing fell.
107;00:10:35,639;00:10:38,351;He was sitting in the Iron Throne
107;00:10:35,639;00:10:38,351;and you made him give it up.
108;00:10:38,450;00:10:42,840;All you needed to do is climb the steps
108;00:10:38,450;00:10:42,840;yourself. Such a sad mistake.
109;00:10:43,505;00:10:46,217;I've made many mistakes in my life,
110;00:10:47,253;00:10:49,042;but that wasn't one of them.
111;00:10:49,066;00:10:50,442;Oh, but it was.
112;00:10:51,629;00:10:55,230;When you play the game of thrones,
112;00:10:51,629;00:10:55,230;you win or you die.
113;00:10:56,315;00:10:57,843;There is no middle ground.
114;00:11:45,942;00:11:48,766;No, No, No, No...
115;00:11:50,218;00:11:52,634;is that what they teach you
115;00:11:50,218;00:11:52,634;up in the North?
116;00:11:54,156;00:11:57,119;And you, wherever you're from.
117;00:11:58,093;00:12:01,744;Do you have any idea
117;00:11:58,093;00:12:01,744;how ridiculous you sound?
118;00:12:02,032;00:12:05,244;Either of you understand the thing that I'm saying?
119;00:12:06,219;00:12:07,496;Yes, my lord.
120;00:12:08,344;00:12:10,869;Let's start over. Shall we?
121;00:12:11,967;00:12:15,558;You be the man, and you be the woman.
122;00:12:20,594;00:12:21,908;Go ahead.
123;00:12:24,468;00:12:25,844;Slowly.
124;00:12:35,032;00:12:39,932;You're not fooling them,
124;00:12:35,032;00:12:39,932;they just paid you, they know what you are.
125;00:12:40,469;00:12:42,684;They know it's all just an act
126;00:12:42,781;00:12:45,744;Your job is to make them
126;00:12:42,781;00:12:45,744;forget what they know.
127;00:12:46,044;00:12:47,493;And that takes time.
128;00:12:48,533;00:12:49,850;You need to...
129;00:12:50,388;00:12:52,746;ease into it.
130;00:12:55,094;00:12:56,370;Go ahead.
131;00:12:57,471;00:13:00,058;Ease into it.
132;00:13:09,032;00:13:12,121;He's winding you over,
132;00:13:09,032;00:13:12,121;in spite of yourself.
133;00:13:12,221;00:13:14,434;You're starting to like this.
134;00:13:15,533;00:13:17,005;He wants to believe you.
135;00:13:17,094;00:13:19,673;He's enjoyed his cock since he was old enough
136;00:13:19,674;00:13:21,058;to play with a boy, shouldn't you?
137;00:13:21,160;00:13:24,531;He knows, he's better than other men.
138;00:13:24,532;00:13:28,245;He's always known it deep down inside
138;00:13:24,532;00:13:28,245;now he has proof.
139;00:13:28,735;00:13:29,822;He's so good...
140;00:13:30,823;00:13:35,309;he's reaching something deep inside of you
140;00:13:30,823;00:13:35,309;that no one even knew was there.
141;00:13:35,597;00:13:38,247;Overcoming your very nature...
142;00:13:40,348;00:13:42,636;Why don't you join us, my lord?
143;00:13:43,908;00:13:46,134;I'm saving myself for another.
144;00:13:46,996;00:13:48,843;What she doesn't know
144;00:13:46,996;00:13:48,843;will not hurt her?
145;00:13:48,844;00:13:50,323;A stupid saying...
146;00:13:51,095;00:13:54,734;What we don't know is usually
146;00:13:51,095;00:13:54,734;what get us killed.
147;00:13:55,722;00:13:57,434;She must be very beautiful.
148;00:13:57,473;00:14:01,398;No, not really.
148;00:13:57,473;00:14:01,398;Impeccable bloodlines, though.
149;00:14:01,471;00:14:03,371;I do believe my lord in love.
150;00:14:03,409;00:14:06,634;For many years.
150;00:14:03,409;00:14:06,634;Most of my life really.
151;00:14:07,100;00:14:08,600;Play with her ass.
152;00:14:08,701;00:14:10,401;And she loved me too.
153;00:14:11,202;00:14:13,202;I was her little confidant.
154;00:14:14,203;00:14:18,003;A play thing. She could tell me anything,
154;00:14:14,203;00:14:18,003;anything at all.
155;00:14:18,404;00:14:22,604;She told me about
155;00:14:18,404;00:14:22,604;all the horses that she liked.
156;00:14:22,605;00:14:27,005;The castle that she want to live in.
156;00:14:22,605;00:14:27,005;The man that she wanted to marry.
157;00:14:27,707;00:14:29,207;A northerner...
158;00:14:29,608;00:14:31,608;with a jaw like an anvil.
159;00:14:32,408;00:14:36,908;So I challenged him to a duel. I mean,
159;00:14:32,408;00:14:36,908;why not? I'd read all the stories.
160;00:14:37,309;00:14:41,500;The little hero always beats
160;00:14:37,309;00:14:41,500;the big villain in all the stories.
161;00:14:41,592;00:14:45,400;In the end...
161;00:14:41,592;00:14:45,400;she wouldn't even let him kill me.
162;00:14:45,601;00:14:48,101;He's just a boy, she said.
163;00:14:48,402;00:14:50,202;Please don't hurt him.
164;00:14:50,903;00:14:55,203;So he gave me a nice little scar to remember
164;00:14:50,903;00:14:55,203;and by enough they went
165;00:14:55,204;00:14:57,704;And she still married to him?
165;00:14:55,204;00:14:57,704;Oh, no.
166;00:14:57,905;00:15:00,605;He got himself killed before the wedding.
167;00:15:01,906;00:15:06,006;And she ended up with his brother,
167;00:15:01,906;00:15:06,006;an even more impressive specimen.
168;00:15:06,307;00:15:08,607;She loves him, I'm afraid.
169;00:15:08,908;00:15:10,508;And why wouldn't she, I mean?
170;00:15:10,608;00:15:14,008;Who could compare to him,
170;00:15:10,608;00:15:14,008;he just so...
171;00:15:20,603;00:15:21,703;good.
172;00:15:24,304;00:15:27,204;Do you know what I learned
172;00:15:24,304;00:15:27,204;losing that duel?
173;00:15:27,705;00:15:29,605;I learned that I'll never win.
174;00:15:30,006;00:15:32,906;Not that way.
174;00:15:30,006;00:15:32,906;That's their game.
175;00:15:33,507;00:15:35,007;Their rules.
176;00:15:35,908;00:15:37,808;I'm not going to fight them.
177;00:15:38,109;00:15:39,409;I'm going to fuck them.
178;00:15:40,110;00:15:43,110;That's what I know, that's what I am.
179;00:15:43,611;00:15:47,211;And only by admitting what we are,
179;00:15:43,611;00:15:47,211;can we get what we want.
180;00:15:48,212;00:15:49,612;And what do you want?
181;00:15:50,513;00:15:53,113;Oh, everything, my dear.
182;00:15:53,714;00:15:55,314;Everything there is.
183;00:15:58,615;00:16:01,815;Now wash yourself,
183;00:15:58,615;00:16:01,815;both of you are working tonight.
184;00:16:32,524;00:16:34,851;You're very lucky girl,
184;00:16:32,524;00:16:34,851;do you know that?
185;00:16:38,459;00:16:41,570;Where I come from we don't show mercy
185;00:16:38,459;00:16:41,570;to criminals.
186;00:16:41,738;00:16:45,332;Where I come from,
186;00:16:41,738;00:16:45,332;if someone like you attacked a little lord...
187;00:16:45,759;00:16:48,992;the low tide will lay you on your back,
187;00:16:45,759;00:16:48,992;on the beach...
188;00:16:49,161;00:16:51,732;your hands and feet chained to four stakes...
189;00:16:52,206;00:16:54,712;sea will coming closer and closer.
190;00:16:55,234;00:16:59,222;You'll see death creeping toward you,
190;00:16:55,234;00:16:59,222;a few inches at a time.
191;00:17:00,622;00:17:01,985;Where do you come from?
192;00:17:02,615;00:17:04,061;The Iron Islands.
193;00:17:04,833;00:17:06,099;They far away?
194;00:17:06,505;00:17:08,429;You've never heard of the Iron Islands?
195;00:17:08,464;00:17:12,281;Trust me, you've never heard
195;00:17:08,464;00:17:12,281;where I'm from neither.
196;00:17:13,349;00:17:15,509;Trust me, my lord.
197;00:17:18,471;00:17:20,696;You're not living in the wilderness anymore.
198;00:17:20,872;00:17:24,836;In civilized land, you advert
198;00:17:20,872;00:17:24,836;your betters by their proper titles.
199;00:17:25,432;00:17:26,672;And what's that?
200;00:17:27,092;00:17:28,172;Lord.
201;00:17:28,655;00:17:29,783;Why?
202;00:17:31,082;00:17:32,074;Why?
203;00:17:32,868;00:17:34,643;What do you mean why?
204;00:17:34,859;00:17:37,986;My father is Balon Greyjoy,
204;00:17:34,859;00:17:37,986;Lord of the Iron Islands.
205;00:17:38,061;00:17:39,955;What's that got to do with you?
206;00:17:41,175;00:17:45,111;If your father's lord,
206;00:17:41,175;00:17:45,111;how can you be lord too?
207;00:17:45,802;00:17:49,353;I will be lord after my father...
207;00:17:45,802;00:17:49,353;So you're not lord now.
208;00:17:49,372;00:17:50,469;No, you...
209;00:17:52,786;00:17:54,596;You having a go at me?
210;00:17:54,795;00:17:55,795;Is that it?
211;00:17:56,472;00:17:59,324;Just don't understand
211;00:17:56,472;00:17:59,324;how you southerners do things.
212;00:17:59,351;00:18:00,654;I'm not a southerner.
213;00:18:00,710;00:18:02,906;You're from south of The Wall...
214;00:18:03,507;00:18:05,707;that makes you a southerner to me.
215;00:18:08,033;00:18:10,872;You're an impudent little wench,
215;00:18:08,033;00:18:10,872;aren't you?
216;00:18:11,746;00:18:15,542;Couldn't say, my lord.
216;00:18:11,746;00:18:15,542;Didn't know what impunent means.
217;00:18:15,808;00:18:19,040;Impudent. It means rude.
218;00:18:19,694;00:18:21,011;Disrespectful.
219;00:18:25,239;00:18:27,171;Do you want to lose that chain?
220;00:18:29,712;00:18:31,346;Theon Greyjoy!
221;00:18:32,310;00:18:34,570;The lady is our guest.
222;00:18:34,810;00:18:36,148;Thought she was our prisoner.
223;00:18:36,212;00:18:39,856;Are the two mutually exclusive,
223;00:18:36,212;00:18:39,856;in your experience?
224;00:18:50,420;00:18:53,419;Chances are I won't be nearby
224;00:18:50,420;00:18:53,419;the next time that happens.
225;00:18:53,422;00:18:55,658;I'm used to worse than him.
226;00:18:56,509;00:18:59,410;I'm used to men
226;00:18:56,509;00:18:59,410;could chew that boy up,
227;00:18:59,445;00:19:01,784;and pick their teeth with his bones.
228;00:19:08,109;00:19:09,521;Why did you come here?
229;00:19:09,980;00:19:11,859;Didn't mean to come here.
230;00:19:12,541;00:19:14,579;Meant to get much further
230;00:19:12,541;00:19:14,579;south than this.
231;00:19:15,032;00:19:16,890;As far as south as south goes.
232;00:19:18,035;00:19:20,216;Before the long night comes.
233;00:19:20,727;00:19:21,782;Why?
234;00:19:22,005;00:19:23,381;What do you afraid of?
235;00:19:24,294;00:19:28,392;Those things that sleep in the day
235;00:19:24,294;00:19:28,392;and hunt at night.
236;00:19:28,881;00:19:33,015;Owl and shadowcats--
236;00:19:28,881;00:19:33,015;I'm not talking about owl and shadowcats.
237;00:19:37,171;00:19:39,422;The things you speak of...
238;00:19:40,295;00:19:42,805;have been gone for thousands of years.
239;00:19:42,884;00:19:44,794;It wasn't gone, old man.
240;00:19:46,395;00:19:47,995;They were sleeping.
241;00:19:49,115;00:19:51,581;And they ain't sleeping no more.
242;00:20:00,358;00:20:01,993;I missed girls.
243;00:20:03,154;00:20:05,800;Not even talking to them,
243;00:20:03,154;00:20:05,800;I never talk to them.
244;00:20:07,747;00:20:09,397;Just lookin' at them.
245;00:20:09,618;00:20:11,081;Hearing them giggle.
246;00:20:16,857;00:20:18,574;Don't you miss girls?
247;00:20:23,918;00:20:25,006;Riders!
248;00:20:25,910;00:20:28,739;The horn. We have to blow the horn.
249;00:20:29,754;00:20:30,906;Why is he alone?
250;00:20:33,641;00:20:36,010;One blast for a ranger returning,
251;00:20:36,357;00:20:37,794;two for wildlings,
252;00:20:38,233;00:20:40,644;Three--
252;00:20:38,233;00:20:40,644;He's no rider.
253;00:21:14,849;00:21:16,941;That's my uncle Benjen's horse.
254;00:21:24,409;00:21:25,610;Where's my uncle?
255;00:21:29,941;00:21:30,943;Ned!
256;00:21:33,471;00:21:34,718;Robert...
257;00:21:35,220;00:21:37,721;we are hunting... a boar...
258;00:21:44,721;00:21:47,595;I should have spent more time with you.
259;00:21:48,607;00:21:51,180;Shown to you how to be a man.
260;00:21:54,753;00:21:57,402;I was never meant to be a father.
261;00:22:17,424;00:22:18,432;Go on....
262;00:22:19,607;00:22:21,470;you don't want to see this.
263;00:22:35,855;00:22:37,114;My fault...
264;00:22:37,980;00:22:39,381;Too much wine...
265;00:22:40,002;00:22:42,070;Missed my thrust...
266;00:22:50,981;00:22:52,820;Stinks.
267;00:22:53,769;00:22:55,652;Stinks like death.
268;00:22:56,360;00:22:59,042;Don't think I can't smell it.
269;00:23:02,302;00:23:05,167;Pay the bastard back, Ned.
270;00:23:05,480;00:23:08,056;I drove my knife
270;00:23:05,480;00:23:08,056;right through his brain
271;00:23:08,057;00:23:10,317;You ask him if I didn't. Ask him!
272;00:23:11,886;00:23:16,886;I want the funeral feast to be the biggest
272;00:23:11,886;00:23:16,886;the kingdom ever saw...
273;00:23:17,953;00:23:21,741;And I want everyone
273;00:23:17,953;00:23:21,741;to taste the boar that got me
274;00:23:25,166;00:23:28,594;Now leave us, the lot of you
274;00:23:25,166;00:23:28,594;I need to talk to Ned.
275;00:23:29,329;00:23:32,291;Robert, my sweet...
275;00:23:29,329;00:23:32,291;Out! All of you!
276;00:23:51,972;00:23:53,783;You damn fool.
277;00:23:54,363;00:23:56,400;Paper and ink. On the table.
278;00:23:56,701;00:23:58,301;Write down what I said.
279;00:24:06,307;00:24:09,819;In the name of Robert
279;00:24:06,307;00:24:09,819;of the House Baratheon
280;00:24:10,520;00:24:15,520;First of... you know how it goes.
280;00:24:10,520;00:24:15,520;Put in the damn titles...
281;00:24:16,436;00:24:17,927;I hereby command...
282;00:24:18,328;00:24:23,028;Eddard of House Stark...
282;00:24:18,328;00:24:23,028;titles...titles...
283;00:24:24,038;00:24:29,052;to serve as Lord Regent and Protector of The Realm, upon my death...
284;00:24:29,787;00:24:32,187;to rule in my stead...
285;00:24:32,786;00:24:36,286;until my son Joffrey comes of age.
286;00:24:53,918;00:24:54,974;Give it over...
287;00:25:11,002;00:25:12,567;Give it to the council...
288;00:25:13,068;00:25:14,568;after I'm death.
289;00:25:16,175;00:25:20,729;At least they'll say I did this right, this one thing.
290;00:25:20,926;00:25:22,812;You'll rule now.
291;00:25:23,962;00:25:26,425;You'll hate it worse than I did...
292;00:25:27,365;00:25:28,810;but you'll do it well.
293;00:25:33,297;00:25:34,535;The girl...
294;00:25:35,536;00:25:36,836;Daenerys...
295;00:25:38,937;00:25:40,237;you're right.
296;00:25:40,324;00:25:44,423;Varys, Littlefinger, my brother...
296;00:25:40,324;00:25:44,423;Worthless...
297;00:25:45,301;00:25:47,476;No one to tell me No but you.
298;00:25:49,777;00:25:50,777;Only you.
299;00:25:55,152;00:25:56,603;Let her live
300;00:25:58,404;00:26:01,604;Stop it if it's not too late.
300;00:25:58,404;00:26:01,604;I will.
301;00:26:02,638;00:26:03,910;My son...
302;00:26:05,511;00:26:07,111;help him, Ned.
303;00:26:08,547;00:26:10,459;Make him better than me
304;00:26:11,509;00:26:12,619;I'll...
305;00:26:14,482;00:26:17,450;I'll do everything I can
305;00:26:14,482;00:26:17,450;to honor your memory.
306;00:26:17,530;00:26:19,216;My memory?
307;00:26:22,449;00:26:25,087;King Robert Baratheon...
308;00:26:25,988;00:26:28,388;murdered by a pig.
309;00:26:31,963;00:26:35,312;Give me something to the pain,
309;00:26:31,963;00:26:35,312;and let me die.
310;00:26:50,074;00:26:51,948;Give him milk of the poppy.
311;00:27:00,168;00:27:02,861;He was reeling from the wine...
312;00:27:04,147;00:27:05,525;He commanded us to...
313;00:27:05,926;00:27:07,626;step aside, but...
314;00:27:08,973;00:27:10,383;I failed him.
315;00:27:13,074;00:27:16,026;No men could've protected him from himself.
316;00:27:17,674;00:27:22,801;I wonder, Ser Barristan,
316;00:27:17,674;00:27:22,801;who gave the King this wine?
317;00:27:23,736;00:27:26,611;His squire.
317;00:27:23,736;00:27:26,611;From the King's own skin.
318;00:27:26,696;00:27:29,625;His squire? The Lannister boy?
319;00:27:29,947;00:27:34,466;Such a dutiful boy to make sure
319;00:27:29,947;00:27:34,466;His Grace did not lack refreshment.
320;00:27:35,148;00:27:38,584;I do hope the poor lad
320;00:27:35,148;00:27:38,584;does not blame himself.
321;00:27:46,575;00:27:50,997;His Grace has had a change of heart
321;00:27:46,575;00:27:50,997;concerning Daenerys Targaryen.
322;00:27:52,450;00:27:55,387;Whatever arrangements you made...
323;00:27:56,231;00:27:59,418;unmade them, at once.
324;00:27:59,505;00:28:02,810;I'm afraid those birds have flown.
325;00:28:03,024;00:28:05,419;The Khaleesi likely dead already.
326;00:29:46,123;00:29:48,351;Can you help me make him...understand?
327;00:29:48,445;00:29:51,186;The Dothraki do things on their own time
327;00:29:48,445;00:29:51,186;for their own reason
328;00:29:51,201;00:29:54,809;Have patience, Khaleesi. We will
328;00:29:51,201;00:29:54,809;go home, I promise you.
329;00:29:54,860;00:29:56,111;My brother...
330;00:29:56,312;00:30:00,312;was a fool, I know.. but he was
330;00:29:56,312;00:30:00,312;the rightful heir to the Seven Kingdoms.
331;00:30:01,672;00:30:03,292;Have I said something funny, ser?
332;00:30:03,327;00:30:06,316;Forgive me, khaleesi, but your ancestor,
332;00:30:03,327;00:30:06,316;Aegon The Conqueror,
333;00:30:06,317;00:30:09,048;didn't seize six of the kingdoms
