674;00:56:43,758;00:56:45,699;We have a new king now.
675;00:56:48,078;00:56:52,008;Lord Eddard, when we last spoke
675;00:56:48,078;00:56:52,008;you offer me some counsel.
676;00:56:52,148;00:56:54,289;Allow me to return the courtesy.
677;00:56:54,810;00:56:56,540;Bend the knee, my lord.
678;00:56:56,880;00:57:00,240;Bend the knee
678;00:56:56,880;00:57:00,240;and swear loyalty to my son.
679;00:57:00,860;00:57:03,485;And we shall allow you to live out the days
679;00:57:00,860;00:57:03,485;in the grey waste...
680;00:57:03,520;00:57:06,111;you called home.
681;00:57:06,259;00:57:08,798;Your son has no claim to the throne.
682;00:57:08,829;00:57:09,566;Liar!
683;00:57:09,567;00:57:12,531;You condemn yourself
683;00:57:09,567;00:57:12,531;with your own mouth, Lord Stark.
684;00:57:12,700;00:57:15,120;Ser Barristan, seize this traitor.
685;00:57:15,990;00:57:19,609;Ser Barristan is a good man,
685;00:57:15,990;00:57:19,609;a loyal man, do him no harm.
686;00:57:22,059;00:57:23,730;You think you stand alone?
687;00:57:26,648;00:57:29,759;Kill him! Kill all of them.
687;00:57:26,648;00:57:29,759;I commanded.
688;00:57:30,048;00:57:31,268;Commander!
689;00:57:31,738;00:57:34,427;Take the queen and
689;00:57:31,738;00:57:34,427;her children to custody.
690;00:57:34,428;00:57:38,317;Escort them back to the royal apartment
690;00:57:34,428;00:57:38,317;and keep them there under guard.
691;00:57:38,318;00:57:39,758;Men of the watch!
692;00:57:44,248;00:57:46,008;I want no bloodshed.
693;00:57:46,758;00:57:50,998;Tell your men to lay down their swords,
693;00:57:46,758;00:57:50,998;no one needs to die.
694;00:57:53,288;00:57:54,388;Now!
695;00:58:05,817;00:58:08,718;I did warn you not to trust me.
696;00:58:11,621;00:58:16,998;www.addic7ed.com
697;00:01:27,500;00:01:29,000;<font color=#ffff00 size=14>www.tvsubtitles.net</font>
698;00:00:00,500;00:00:02,000;<font color=#ffff00 size=14>www.tvsubtitles.net</font>
9999;00:00:0,500;00:00:2,00;<font color=#ffff00 size=14>www.tvsubtitles.net</font>
