1;00:02:00,913;00:02:03,164;It's got to be the Mountain.
1;00:02:00,913;00:02:03,164;He's the biggest.
2;00:02:03,248;00:02:05,583;He's the strongest.
2;00:02:03,248;00:02:05,583;Bulls are bigger than lions.
3;00:02:05,667;00:02:07,460;Doesn't mean I'd pick a bull in a fight.
4;00:02:07,544;00:02:10,630;If the bull had fangs and claws, I would.
5;00:02:10,714;00:02:14,383;Right, the Mountain or our man Jaime.
6;00:02:14,468;00:02:16,969;If he ever gets out.
7;00:02:17,387;00:02:18,596;Loras Tyrell?
8;00:02:18,680;00:02:21,808;Loras Tyrell. He's prettier than the Queen.
9;00:02:21,892;00:02:24,644;I don't care about pretty.
9;00:02:21,892;00:02:24,644;He's better with a sword than any of them.
10;00:02:24,728;00:02:26,979;How good could he be?
11;00:02:27,064;00:02:31,234;He's been stabbing Renly Baratheon for years,
11;00:02:27,064;00:02:31,234;and Renly ain't dead.
12;00:02:40,744;00:02:42,870;The horses seem a little spooked to you?
13;00:02:42,955;00:02:44,497;They're horses.
14;00:02:44,957;00:02:47,166;They get spooked by their own shadows.
15;00:02:51,213;00:02:52,839;Do you hear that?
16;00:02:54,383;00:02:55,716;No.
17;00:02:56,677;00:02:58,803;There's something out there.
18;00:03:21,326;00:03:22,869;Oh.
19;00:03:23,537;00:03:25,872;Oh, you're a right little prick.
20;00:03:25,956;00:03:27,498;You should see your face.
21;00:03:27,583;00:03:29,625;I swear you pissed yourself.
22;00:03:30,002;00:03:31,711;Oh, who goes there? Ahh!
23;00:03:32,963;00:03:34,046;There is something out there.
24;00:03:34,131;00:03:36,215;Yeah, don't even try me.
25;00:03:36,800;00:03:38,801;Rennick.
25;00:03:36,800;00:03:38,801;Do you think I'm an idiot?
26;00:03:40,095;00:03:41,470;Rennick!
27;00:03:48,103;00:03:51,480;King in the North!
27;00:03:48,103;00:03:51,480;The King in the North!
28;00:04:12,336;00:04:14,378;Five Lannisters dead
28;00:04:12,336;00:04:14,378;for every one of ours.
29;00:04:14,713;00:04:16,255;They're dead.
29;00:04:14,713;00:04:16,255;Take everything they've got.
30;00:04:16,340;00:04:18,007;We've nowhere to keep
30;00:04:16,340;00:04:18,007;all these prisoners.
31;00:04:18,842;00:04:20,927;Barely enough food to feed our own.
32;00:04:21,011;00:04:22,929;We're not executing prisoners, Lord Bolton.
33;00:04:23,013;00:04:24,597;Of course, Your Grace.
34;00:04:24,932;00:04:27,183;The officers will be useful.
35;00:04:27,476;00:04:30,269;Some of them may be privy
35;00:04:27,476;00:04:30,269;to Tywin Lannister's plans.
36;00:04:30,354;00:04:31,354;I doubt it.
37;00:04:32,439;00:04:33,981;Well, we'll learn soon enough.
38;00:04:34,358;00:04:38,152;In my family, we say,
38;00:04:34,358;00:04:38,152;A naked man has few secrets.
39;00:04:38,236;00:04:40,029;A flayed man none.
40;00:04:40,113;00:04:42,114;My father outlawed flaying in the North.
41;00:04:42,199;00:04:45,326;We're not in the North.
41;00:04:42,199;00:04:45,326;We're not torturing them.
42;00:04:45,410;00:04:47,328;The high road's very pretty,
43;00:04:47,412;00:04:49,121;but you'll have a hard time
43;00:04:47,412;00:04:49,121;marching your army down it.
44;00:04:50,248;00:04:52,959;The Lannisters hold prisoners of their own.
45;00:04:53,251;00:04:56,087;I won't give them an excuse
45;00:04:53,251;00:04:56,087;to abuse my sisters.
46;00:04:57,172;00:04:59,632;No, don't! Don't! Please!
47;00:05:04,388;00:05:06,430;The rot's set in.
48;00:05:06,515;00:05:08,391;No, don't! No, don't!
49;00:05:09,309;00:05:11,644;Shh.
49;00:05:09,309;00:05:11,644;Please, don't!
50;00:05:11,728;00:05:13,604;It'll get better. It doesn't even hurt.
51;00:05:13,689;00:05:16,565;The rot will spread.
51;00:05:13,689;00:05:16,565;If we don't take the foot now...
52;00:05:16,692;00:05:18,442;No, you can't!
53;00:05:21,863;00:05:23,739;Ser! Please, ser.
54;00:05:23,824;00:05:25,324;I can't lose...
54;00:05:23,824;00:05:25,324;You'll die if she doesn't.
55;00:05:25,742;00:05:27,326;I don't want to be a cripple, please.
56;00:05:27,411;00:05:30,246;Surely one of our men
56;00:05:27,411;00:05:30,246;needs your attention more than this cub.
57;00:05:30,414;00:05:32,707;Your men are not my men, my lord.
58;00:05:32,791;00:05:35,334;Put this in your mouth and lie down.
58;00:05:32,791;00:05:35,334;You don't want to watch.
59;00:05:35,419;00:05:37,920;No! You can't!
59;00:05:35,419;00:05:37,920;Bite on it.
60;00:05:38,213;00:05:40,214;It's better than biting your own tongue,
60;00:05:38,213;00:05:40,214;believe me.
61;00:06:15,167;00:06:17,293;What's your name?
61;00:06:15,167;00:06:17,293;Talisa.
62;00:06:17,753;00:06:19,336;Your last name?
63;00:06:19,463;00:06:21,714;You want to know what side
63;00:06:19,463;00:06:21,714;my family fights on?
64;00:06:21,965;00:06:23,716;You know my family name.
64;00:06:21,965;00:06:23,716;You have me at a disadvantage.
65;00:06:23,800;00:06:26,427;That boy lost his foot on your orders.
66;00:06:27,846;00:06:29,013;They killed my father.
67;00:06:29,431;00:06:31,932;That boy did?
67;00:06:29,431;00:06:31,932;The family he fights for.
68;00:06:32,225;00:06:34,769;Do you think he's friends with King Joffrey?
69;00:06:35,312;00:06:37,688;He's a fisherman's son
69;00:06:35,312;00:06:37,688;that grew up near Lannisport.
70;00:06:37,773;00:06:40,816;He probably never held a spear before they
70;00:06:37,773;00:06:40,816;shoved one in his hands a few months ago.
71;00:06:40,901;00:06:42,902;I have no hatred for the lad.
72;00:06:45,030;00:06:46,322;That should help his foot grow back.
73;00:06:50,786;00:06:53,370;You'd have us surrender,
73;00:06:50,786;00:06:53,370;end all this bloodshed.
74;00:06:53,455;00:06:56,415;I understand. The country would be at peace
75;00:06:56,500;00:06:59,835;and life would be just under
75;00:06:56,500;00:06:59,835;the righteous hand of good King Joffrey.
76;00:06:59,920;00:07:02,713;You're going to kill Joffrey?
76;00:06:59,920;00:07:02,713;If the gods give me strength.
77;00:07:02,798;00:07:05,007;And then what?
77;00:07:02,798;00:07:05,007;I don't know.
78;00:07:06,259;00:07:08,260;We'll go back to Winterfell.
79;00:07:08,345;00:07:09,970;I have no desire to sit on the Iron Throne.
80;00:07:11,181;00:07:12,681;So who will?
81;00:07:13,016;00:07:14,642;I don't know.
82;00:07:15,352;00:07:16,936;You're fighting to overthrow a king,
83;00:07:17,020;00:07:18,395;and yet you have no plan
83;00:07:17,020;00:07:18,395;for what comes after?
84;00:07:18,814;00:07:20,856;First we have to win the war.
85;00:07:26,613;00:07:28,656;You never told me where you're from.
86;00:07:28,740;00:07:31,700;Volantis.
86;00:07:28,740;00:07:31,700;Volantis? You're far from home.
87;00:07:33,620;00:07:35,788;The boy was lucky you were here.
88;00:07:35,872;00:07:38,082;He was unlucky that you were.
89;00:07:48,135;00:07:49,844;You're here to answer
89;00:07:48,135;00:07:49,844;for your brother's latest treasons.
90;00:07:50,720;00:07:51,887;Your Grace,
91;00:07:51,972;00:07:55,141;whatever my traitor brother has done,
91;00:07:51,972;00:07:55,141;I had no part.
92;00:07:55,225;00:07:56,642;You know that. I beg you, please...
93;00:07:56,726;00:07:58,477;Ser Lancel, tell her of this outrage.
94;00:07:58,562;00:08:00,229;Using some vile sorcery,
95;00:08:00,313;00:08:03,274;your brother fell on Stafford Lannister
95;00:08:00,313;00:08:03,274;with an army of wolves.
96;00:08:03,900;00:08:06,277;Thousands of good men were butchered.
97;00:08:06,361;00:08:10,531;After the slaughter,
97;00:08:06,361;00:08:10,531;the Northmen feasted on the flesh of the slain.
98;00:08:12,742;00:08:15,202;Killing you
98;00:08:12,742;00:08:15,202;would send your brother a message.
99;00:08:18,957;00:08:21,250;But my mother insists on keeping you alive.
100;00:08:21,668;00:08:22,918;Stand.
101;00:08:24,671;00:08:28,132;So we'll have to send
101;00:08:24,671;00:08:28,132;your brother a message some other way.
102;00:08:29,885;00:08:31,343;Meryn.
103;00:08:35,265;00:08:38,684;Leave her face. I like her pretty.
104;00:08:46,276;00:08:48,402;Meryn, my lady is overdressed.
105;00:08:49,279;00:08:50,779;Unburden her.
106;00:08:56,620;00:09:00,748;If you want Robb Stark to hear us,
106;00:08:56,620;00:09:00,748;we're going to have to speak louder.
107;00:09:02,626;00:09:04,543;What is the meaning of this?
108;00:09:13,595;00:09:15,846;What kind of knight beats a helpless girl?
109;00:09:15,931;00:09:18,057;The kind who serves his king, Imp.
110;00:09:18,141;00:09:21,310;Careful, now. We don't want to get blood
110;00:09:18,141;00:09:21,310;all over your pretty white cloak.
111;00:09:21,728;00:09:24,230;Someone get the girl
111;00:09:21,728;00:09:24,230;something to cover herself with.
112;00:09:24,481;00:09:26,649;She is to be your queen.
113;00:09:26,983;00:09:28,400;Have you no regard for her honor?
114;00:09:28,485;00:09:30,736;I'm punishing her.
114;00:09:28,485;00:09:30,736;For what crimes?
115;00:09:30,820;00:09:32,988;She did not fight her brother's battle,
115;00:09:30,820;00:09:32,988;you half-wit.
116;00:09:33,073;00:09:35,824;You can't talk to me like that.
116;00:09:33,073;00:09:35,824;The king can do as he likes!
117;00:09:36,493;00:09:38,661;The Mad King did as he liked.
118;00:09:38,912;00:09:41,789;Has your Uncle Jaime ever told you
118;00:09:38,912;00:09:41,789;what happened to him?
119;00:09:41,957;00:09:44,792;No one threatens His Grace
119;00:09:41,957;00:09:44,792;in the presence of the Kingsguard.
120;00:09:45,085;00:09:48,504;I'm not threatening the king, ser.
120;00:09:45,085;00:09:48,504;I am educating my nephew.
121;00:09:48,797;00:09:51,674;Bronn, the next time Ser Meryn speaks,
121;00:09:48,797;00:09:51,674;kill him.
122;00:09:53,260;00:09:56,053;That was a threat. See the difference?
123;00:10:18,368;00:10:21,036;I apologize for my nephew's behavior.
124;00:10:23,373;00:10:26,583;Tell me the truth.
124;00:10:23,373;00:10:26,583;Do you want an end to this engagement?
125;00:10:26,668;00:10:29,878;I am loyal to King Joffrey, my one true love.
126;00:10:33,883;00:10:38,220;Lady Stark, you may survive us yet.
127;00:10:43,018;00:10:44,727;The little king's backed up.
128;00:10:45,228;00:10:47,479;Clogged from balls to brains.
129;00:10:48,106;00:10:50,774;You think dipping his wick
129;00:10:48,106;00:10:50,774;will cure what ails him?
130;00:10:50,859;00:10:53,235;There's no cure for being a cunt.
131;00:10:53,903;00:10:55,988;But the boy's at that age.
132;00:10:56,072;00:10:59,658;And he's got nothing to do all day
132;00:10:56,072;00:10:59,658;but pick wings off flies.
133;00:10:59,743;00:11:02,411;Couldn't hurt to get some of the poison out.
134;00:11:10,170;00:11:11,879;What are you doing here, dog?
135;00:11:11,963;00:11:16,425;Your uncle left your nameday present
135;00:11:11,963;00:11:16,425;and asked me to see that you got it.
136;00:11:19,596;00:11:20,929;And?
137;00:11:21,681;00:11:23,182;What is it?
138;00:11:23,892;00:11:25,976;Look inside, Your Grace.
139;00:11:32,192;00:11:33,650;Your Grace.
140;00:11:34,778;00:11:37,613;Happy nameday, Your Grace.
140;00:11:34,778;00:11:37,613;My nameday has passed.
141;00:11:37,989;00:11:40,115;We won't tell if you won't.
142;00:11:43,912;00:11:45,120;No.
143;00:11:46,748;00:11:47,831;Her.
144;00:11:50,251;00:11:51,752;Touch her.
145;00:12:13,483;00:12:15,025;Could you hit her?
146;00:12:28,665;00:12:30,165;My uncle sent you?
147;00:12:30,792;00:12:33,669;Yes, Your Grace. He chose us himself.
148;00:12:33,962;00:12:35,295;Hmm.
149;00:12:44,597;00:12:46,181;Use this.
150;00:12:59,362;00:13:00,654;Harder.
151;00:13:05,326;00:13:08,537;I said harder.
152;00:13:11,207;00:13:14,001;He'd want me to get his money's worth.
153;00:13:56,961;00:14:00,088;Your Grace, too much pain
153;00:13:56,961;00:14:00,088;will spoil the pleasure.
154;00:14:09,516;00:14:10,766;Please, Your Grace.
155;00:14:12,894;00:14:14,520;Your Grace, if your uncle finds out...
156;00:14:14,604;00:14:16,563;Oh, I want him to find out.
157;00:14:17,232;00:14:20,400;You will bring her
157;00:14:17,232;00:14:20,400;to his chambers when you're finished
158;00:14:20,485;00:14:22,236;and show him what you've done,
159;00:14:24,280;00:14:26,448;or the same thing will happen to you.
160;00:14:32,914;00:14:34,540;Begin.
161;00:14:43,299;00:14:44,675;Harder!
162;00:14:55,979;00:14:58,981;Well, if it isn't my favorite whoremonger.
163;00:14:59,983;00:15:02,776;Pray I haven't kept you waiting long.
164;00:15:04,737;00:15:06,738;Your Grace.
165;00:15:09,909;00:15:13,203;Now you do the Lannisters' bidding,
165;00:15:09,909;00:15:13,203;is that it?
166;00:15:13,705;00:15:18,667;Tell me, was my brother's body even cold
166;00:15:13,705;00:15:18,667;before you secured your newest patron?
167;00:15:19,460;00:15:20,836;I'm a practical man.
168;00:15:22,714;00:15:24,506;Just not a loyal one.
169;00:15:24,591;00:15:26,258;And who would you have me be loyal to?
170;00:15:26,718;00:15:28,218;Your brother's corpse?
171;00:15:31,055;00:15:33,348;I don't like you, Lord Baelish.
172;00:15:34,309;00:15:36,393;I don't like your face.
173;00:15:36,477;00:15:39,229;I don't like the words
173;00:15:36,477;00:15:39,229;that come oozing out of your mouth.
174;00:15:40,106;00:15:43,150;I don't want you in my tent
174;00:15:40,106;00:15:43,150;one minute more than necessary.
175;00:15:43,234;00:15:45,652;So tell me, why are you here?
176;00:15:47,697;00:15:51,199;You can trust Brienne.
176;00:15:47,697;00:15:51,199;Her loyalty comes without charge.
177;00:15:54,370;00:15:56,997;You still have many friends
177;00:15:54,370;00:15:56,997;at court, Your Grace,
178;00:15:57,081;00:16:01,918;many who believe Ned Stark erred
178;00:15:57,081;00:16:01,918;by not supporting your claim.
179;00:16:03,880;00:16:05,547;Now I understand.
180;00:16:06,716;00:16:11,094;You know I have the numbers.
180;00:16:06,716;00:16:11,094;You know I'm marching on King's Landing.
181;00:16:11,929;00:16:14,890;When I take the throne,
181;00:16:11,929;00:16:14,890;you hope to retain your position.
182;00:16:16,726;00:16:18,060;And your head.
183;00:16:18,186;00:16:20,103;I would give priority to my head.
184;00:16:21,439;00:16:25,859;I understand that you don't like me,
184;00:16:21,439;00:16:25,859;and while that saddens me greatly,
185;00:16:25,985;00:16:28,487;I did not come here today
185;00:16:25,985;00:16:28,487;seeking your affection.
186;00:16:30,448;00:16:32,157;When you march on King's Landing,
187;00:16:32,241;00:16:35,369;you may find yourself facing
187;00:16:32,241;00:16:35,369;a protracted siege or...
188;00:16:37,121;00:16:38,580;open gates.
189;00:16:56,808;00:16:58,433;Your Grace.
190;00:16:58,518;00:16:59,976;Lord Baelish.
191;00:17:01,604;00:17:04,564;All of these tents look the same to me.
192;00:17:04,649;00:17:06,983;Would you be so kind...
192;00:17:04,649;00:17:06,983;It would be my pleasure.
193;00:17:07,110;00:17:09,444;It took me weeks
193;00:17:07,110;00:17:09,444;to learn my way around the camp.
194;00:17:09,529;00:17:12,948;Twice I walked in on officers
194;00:17:09,529;00:17:12,948;in stages of undress.
195;00:17:13,032;00:17:17,077;And the moment I learn which tent is mine,
195;00:17:13,032;00:17:17,077;we're on the move again.
196;00:17:17,161;00:17:18,787;Your tent?
197;00:17:18,955;00:17:20,789;Not Our tent?
198;00:17:22,041;00:17:25,961;The king snores, perhaps?
198;00:17:22,041;00:17:25,961;Or simply prefers solitude?
199;00:17:27,130;00:17:29,715;Pressures of command, no doubt.
200;00:17:29,799;00:17:32,134;Four kings vying for the throne.
201;00:17:32,635;00:17:34,386;I am not tutored in warfare,
202;00:17:34,470;00:17:38,306;but basic arithmetic
202;00:17:34,470;00:17:38,306;favors the side with the greater numbers.
203;00:17:38,474;00:17:42,310;If war were arithmetic,
203;00:17:38,474;00:17:42,310;the mathematicians would rule the world.
204;00:17:43,813;00:17:46,523;I did notice your brother
204;00:17:43,813;00:17:46,523;entering His Grace's tent just now.
205;00:17:46,607;00:17:48,734;The place of a Kingsguard
205;00:17:46,607;00:17:48,734;is by the king's side.
206;00:17:48,818;00:17:53,113;And on the night of your wedding,
206;00:17:48,818;00:17:53,113;who was by the king's side then?
207;00:17:53,531;00:17:55,574;You seem quite interested in our marriage.
208;00:17:55,700;00:17:58,243;Your marriage is quite interesting.
209;00:17:58,494;00:18:01,121;Not only to me, but to the realm.
210;00:18:01,497;00:18:06,501;The marriage of a wealthy girl
210;00:18:01,497;00:18:06,501;always breeds interest, if nothing else.
211;00:18:07,128;00:18:08,587;You've never married, have you?
212;00:18:09,547;00:18:13,008;I've been unlucky in my affections, sadly.
213;00:18:14,260;00:18:15,927;That is sad.
214;00:18:16,012;00:18:17,429;Though perhaps it's for the best.
215;00:18:17,513;00:18:19,514;The whole notion of marriage
215;00:18:17,513;00:18:19,514;seems to confuse you,
216;00:18:19,974;00:18:21,516;so allow me to explain.
217;00:18:21,726;00:18:25,103;My husband is my king,
217;00:18:21,726;00:18:25,103;and my king is my husband.
218;00:18:26,606;00:18:29,691;Here is your tent, Lord Baelish. Good night.
219;00:19:02,600;00:19:04,351;This isn't your horse.
220;00:19:07,271;00:19:09,314;It was given to me by the Thirteen.
221;00:19:09,440;00:19:10,899;The Elders of Qarth.
222;00:19:11,275;00:19:12,275;Qarth?
223;00:19:12,652;00:19:15,862;Three days to the east, on the sea.
224;00:19:16,739;00:19:18,073;Will they let us in?
225;00:19:18,241;00:19:21,952;They said they would be honored
225;00:19:18,241;00:19:21,952;to receive the Mother of Dragons.
226;00:19:25,414;00:19:27,207;What do you know of this place?
227;00:19:27,708;00:19:31,336;Only that the desert around their walls
227;00:19:27,708;00:19:31,336;is called the Garden of Bones.
228;00:19:33,339;00:19:36,633;Every time the Qartheen
228;00:19:33,339;00:19:36,633;shut their gates on a traveler,
229;00:19:36,717;00:19:38,260;the garden grows.
230;00:19:50,731;00:19:53,567;Go on!
230;00:19:50,731;00:19:53,567;You, keep moving!
231;00:20:01,200;00:20:02,784;Bring her about!
232;00:20:02,869;00:20:05,120;What kind of fire melts stone?
233;00:20:06,873;00:20:08,331;Dragon fire.
234;00:20:08,958;00:20:10,083;There's dragons here?
235;00:20:10,418;00:20:12,711;No, all the dragons are dead.
236;00:20:13,629;00:20:14,796;What's that smell?
237;00:20:17,008;00:20:18,466;Dead people.
238;00:20:19,427;00:20:20,510;Move.
239;00:20:30,187;00:20:32,105;Please, please, no, no!
240;00:20:39,572;00:20:40,822;No.
241;00:20:51,542;00:20:52,876;He's dead.
242;00:20:55,379;00:20:56,880;He was my son.
243;00:20:59,383;00:21:01,676;My sister was three days ago.
244;00:21:03,054;00:21:05,513;My husband, the day before that.
245;00:21:06,724;00:21:09,100;They take someone every day?
246;00:21:11,354;00:21:13,021;Does anyone live?
247;00:21:36,879;00:21:38,088;Joffrey.
248;00:21:39,298;00:21:40,507;Cersei.
249;00:21:41,384;00:21:42,759;llyn Payne.
250;00:21:43,219;00:21:44,552;The Hound.
251;00:21:45,179;00:21:46,388;Joffrey.
252;00:21:47,723;00:21:48,932;Cersei.
253;00:21:50,226;00:21:51,601;llyn Payne.
254;00:21:52,103;00:21:53,436;The Hound.
255;00:21:54,146;00:21:56,231;Joffrey. Cersei.
256;00:21:57,024;00:21:58,900;llyn Payne. The Hound.
257;00:22:04,448;00:22:05,615;How dare you?
258;00:22:05,741;00:22:07,701;You may have heard false reports.
259;00:22:07,827;00:22:09,995;You betrayed Ned.
259;00:22:07,827;00:22:09,995;Betrayed?
260;00:22:10,079;00:22:11,871;I wanted him to serve
260;00:22:10,079;00:22:11,871;as Protector of the Realm.
261;00:22:11,956;00:22:13,748;I begged him to seize the moment.
262;00:22:13,833;00:22:17,210;I trusted you. My husband trusted you.
263;00:22:18,129;00:22:21,089;And you repaid our faith with treachery.
264;00:22:21,215;00:22:22,298;No, my lady.
264;00:22:21,215;00:22:22,298;Get out!
265;00:22:22,425;00:22:23,800;Cat, I've...
266;00:22:25,094;00:22:27,137;I've loved you since I was a boy.
267;00:22:28,180;00:22:31,224;It seems to me that fate
267;00:22:28,180;00:22:31,224;has given us this chance...
268;00:22:31,392;00:22:33,977;Have you lost your mind? Get out!
269;00:22:48,451;00:22:50,118;Do you want to see your girls again?
270;00:22:52,872;00:22:55,623;Sansa, more beautiful than ever?
271;00:22:56,417;00:22:59,753;And Arya, just as wild as ever?
272;00:23:01,088;00:23:02,464;You have Arya, too?
273;00:23:02,715;00:23:06,468;Both girls are healthy and safe.
274;00:23:07,803;00:23:09,054;For now.
275;00:23:09,972;00:23:12,932;But you know the Queen
275;00:23:09,972;00:23:12,932;and you know Joffrey.
276;00:23:14,226;00:23:18,146;I fear for their longevity
276;00:23:14,226;00:23:18,146;if they remain in the capital.
277;00:23:40,503;00:23:41,628;What do you want?
278;00:23:43,714;00:23:46,257;The Lannisters will trade your daughters
278;00:23:43,714;00:23:46,257;for the Kingslayer.
279;00:23:46,342;00:23:48,093;Of course they will.
280;00:23:48,177;00:23:50,553;Jaime Lannister for two girls?
281;00:23:51,180;00:23:52,889;Robb will never agree to those terms.
282;00:23:52,973;00:23:55,141;I'm not bringing these terms to him.
283;00:23:55,226;00:23:56,518;I'm bringing them to you.
284;00:23:57,019;00:23:59,270;You think I keep secrets from my son?
285;00:23:59,355;00:24:02,023;Robb has surprised them all
285;00:23:59,355;00:24:02,023;with his skills in battle,
286;00:24:02,108;00:24:03,149;but he's not a mother.
287;00:24:04,401;00:24:06,027;Consider it, Cat.
288;00:24:07,613;00:24:09,906;You may not get another chance.
289;00:24:14,370;00:24:16,830;I've brought you a gift.
289;00:24:14,370;00:24:16,830;I don't want your gifts.
290;00:24:16,914;00:24:19,707;A token of Tyrion Lannister's goodwill.
291;00:24:20,417;00:24:24,045;He wants you to understand
291;00:24:20,417;00:24:24,045;that this exchange of prisoners
292;00:24:24,964;00:24:26,297;is offered in good faith.
293;00:24:26,382;00:24:27,715;Good faith?
294;00:24:32,805;00:24:33,972;What's this?
295;00:25:03,752;00:25:05,795;Your husband was an honorable man.
296;00:25:07,131;00:25:10,300;He should rest beside his family
296;00:25:07,131;00:25:10,300;in the crypts beneath Winterfell.
297;00:25:15,097;00:25:17,432;You may not believe...
297;00:25:15,097;00:25:17,432;Get out.
298;00:25:50,507;00:25:52,133;Get up, you dogs!
299;00:26:03,646;00:26:05,688;That's him, the one who picks.
300;00:26:07,566;00:26:08,650;The Mountain.
301;00:26:12,029;00:26:13,404;What are you doing?
302;00:26:13,989;00:26:16,115;He told me he stares at him every day.
303;00:26:16,200;00:26:18,159;That's why he doesn't get picked.
304;00:26:43,769;00:26:44,852;You.
305;00:26:46,021;00:26:47,522;Move, boy!
306;00:26:48,274;00:26:49,357;Move!
307;00:27:09,545;00:27:11,462;Is there gold and silver
307;00:27:09,545;00:27:11,462;in the village?
308;00:27:11,547;00:27:13,464;I don't know.
308;00:27:11,547;00:27:13,464;Gems?
309;00:27:14,633;00:27:16,175;I didn't see any.
310;00:27:16,260;00:27:18,303;Where is the Brotherhood?
310;00:27:16,260;00:27:18,303;I don't know.
311;00:27:34,695;00:27:37,113;Where is the Brotherhood?
311;00:27:34,695;00:27:37,113;I don't know. Please.
312;00:27:37,698;00:27:40,116;Where is the Brotherhood?
312;00:27:37,698;00:27:40,116;I don't know.
313;00:27:46,081;00:27:47,790;Which of the villagers aided them?
314;00:27:47,958;00:27:49,584;I don't know.
314;00:27:47,958;00:27:49,584;Who?
315;00:27:50,044;00:27:51,085;I...
316;00:27:55,382;00:27:59,260;Who?
316;00:27:55,382;00:27:59,260;I never saw.
317;00:27:59,345;00:28:02,680;Please. Please, stop. Please, it's starting to...
318;00:28:02,765;00:28:05,016;Who?
318;00:28:02,765;00:28:05,016;I didn't see anyone help him.
319;00:28:06,310;00:28:08,269;Take it off! Take it off!
320;00:28:08,354;00:28:10,813;Who helped him?
320;00:28:08,354;00:28:10,813;Ganes, the butcher,
321;00:28:10,898;00:28:12,565;and his son.
321;00:28:10,898;00:28:12,565;That's better.
322;00:28:13,067;00:28:15,693;You've been very helpful.
322;00:28:13,067;00:28:15,693;No, stop, please!
323;00:28:15,986;00:28:18,279;What are you doing? Please, stop!
324;00:28:18,364;00:28:20,656;Please, stop! No! No!
325;00:28:20,991;00:28:23,117;I told you everything! No!
326;00:28:23,285;00:28:25,161;No!
327;00:28:27,331;00:28:28,581;Joffrey.
328;00:28:30,125;00:28:31,334;Cersei.
329;00:28:32,086;00:28:34,337;llyn Payne. The Hound.
330;00:28:34,588;00:28:37,006;Please, Polliver. Some food.
331;00:28:37,758;00:28:39,550;Just a crust of bread.
332;00:28:43,972;00:28:45,264;Polliver.
333;00:28:46,141;00:28:47,642;The Mountain.
334;00:29:05,619;00:29:08,413;Lady Stark, I had not thought
334;00:29:05,619;00:29:08,413;to find you in the Stormlands.
335;00:29:08,622;00:29:11,499;I had not thought to be here, Lord Stannis.
336;00:29:12,459;00:29:14,961;Can that truly be you?
336;00:29:12,459;00:29:14,961;Who else might it be?
337;00:29:15,754;00:29:18,172;When I saw your standard, I couldn't be sure.
338;00:29:18,799;00:29:20,758;Whose banner is that?
338;00:29:18,799;00:29:20,758;My own.
339;00:29:22,219;00:29:25,763;I suppose if we used the same one,
339;00:29:22,219;00:29:25,763;the battle would be terribly confusing.
340;00:29:26,223;00:29:28,349;Why is your stag on fire?
341;00:29:29,476;00:29:33,604;The king has taken for his sigil
