642;00:48:08,817;00:48:10,442;Steps.
643;00:48:13,484;00:48:15,609;That number was the steps.
644;00:49:37,567;00:49:40,149;Are you sure
644;00:49:37,567;00:49:40,149;you want to do this?
645;00:49:40,150;00:49:42,567;You always wanted
645;00:49:40,150;00:49:42,567;to be a maester.
646;00:49:44,192;00:49:48,359;I'm tired of reading about
646;00:49:44,192;00:49:48,359;the achievements of better men.
647;00:51:17,442;00:51:19,317;I found it, my lord.
648;00:51:23,025;00:51:24,733;It, uh, took some searching.
649;00:51:24,734;00:51:26,817;Maester Luwin's archives
649;00:51:24,734;00:51:26,817;are very thorough.
650;00:51:31,526;00:51:34,149;You're sure this is the
650;00:51:31,526;00:51:34,149;only copy in Winterfell?
651;00:51:34,150;00:51:36,025;Uh, yes, my lord.
652;00:51:40,817;00:51:42,734;Lady Stark thanks you
652;00:51:40,817;00:51:42,734;for your service.
653;00:54:14,858;00:54:16,733;Isn't it your
653;00:54:14,858;00:54:16,733;job to talk him out
654;00:54:16,734;00:54:18,733;of stupid fucking
654;00:54:16,734;00:54:18,733;ideas like this?
655;00:54:18,734;00:54:21,526;I've been failing
655;00:54:18,734;00:54:21,526;at that job of late.
656;00:54:23,150;00:54:25,191;How many queens are there now?
657;00:54:25,192;00:54:26,525;Two.
658;00:54:26,526;00:54:29,691;And you need to convince
658;00:54:26,526;00:54:29,691;the one with the dragons
659;00:54:29,692;00:54:31,525;or the one who
659;00:54:29,692;00:54:31,525;fucks her brother?
660;00:54:33,359;00:54:34,359;Both.
661;00:54:34,360;00:54:36,400;How many men did you bring?
662;00:54:39,484;00:54:41,024;Not enough.
663;00:54:41,025;00:54:42,651;The big woman?
664;00:54:45,983;00:54:48,775;We were hoping some of
664;00:54:45,983;00:54:48,775;your men could help.
665;00:54:48,776;00:54:51,608;Hmm.
665;00:54:48,776;00:54:51,608;I'll be staying behind.
666;00:54:51,609;00:54:54,733;I'm a liability out there,
666;00:54:51,609;00:54:54,733;as you well know.
667;00:54:54,734;00:54:55,734;You are.
668;00:54:58,526;00:55:01,734;You really want to go out there?
668;00:54:58,526;00:55:01,734;Again?
669;00:55:08,025;00:55:09,776;You're not the only ones.
670;00:55:13,400;00:55:16,899;My scouts found them
670;00:55:13,400;00:55:16,899;a mile south of the Wall.
671;00:55:16,900;00:55:18,776;Said they were
671;00:55:16,900;00:55:18,776;on their way here.
672;00:55:25,609;00:55:27,067;You're the Hound.
673;00:55:29,067;00:55:30,900;I saw you once at Winterfell.
674;00:55:36,609;00:55:38,775;They want to go
674;00:55:36,609;00:55:38,775;beyond the Wall, too.
675;00:55:38,776;00:55:42,066;We don't want to go beyond
675;00:55:38,776;00:55:42,066;the Wall, we have to.
676;00:55:42,067;00:55:44,233;Our Lord told us that
676;00:55:42,067;00:55:44,233;the Great War is coming--
677;00:55:44,234;00:55:46,441;Don't trust him.
678;00:55:46,442;00:55:48,400;Don't trust any of them.
679;00:55:54,025;00:55:55,650;They're the Brotherhood.
680;00:55:55,651;00:55:58,233;And the last thing
680;00:55:55,651;00:55:58,233;their lord told them to do
681;00:55:58,234;00:56:00,608;was sell me to a red witch
681;00:55:58,234;00:56:00,608;to be murdered.
682;00:56:00,609;00:56:02,317;Thoros?
683;00:56:07,359;00:56:09,441;I hardly recognized you.
684;00:56:09,442;00:56:11,650;Ser Jorah Mormont.
685;00:56:11,651;00:56:14,608;They won't give me anything
685;00:56:11,651;00:56:14,608;to drink down here.
686;00:56:14,609;00:56:17,650;I haven't been feeling
686;00:56:14,609;00:56:17,650;like myself.
687;00:56:17,651;00:56:20,483;You're a fucking Mormont?
688;00:56:20,484;00:56:22,608;Like the last Lord Commander?
689;00:56:22,609;00:56:24,816;He was my father.
690;00:56:24,817;00:56:27,816;He hunted us like animals.
691;00:56:27,817;00:56:30,857;You returned the favor,
691;00:56:27,817;00:56:30,857;as I recall.
692;00:56:32,526;00:56:35,149;Here we all are
693;00:56:35,150;00:56:36,733;at the edge of the world
694;00:56:36,734;00:56:38,316;at the same moment,
695;00:56:38,317;00:56:40,817;heading in the same direction
695;00:56:38,317;00:56:40,817;for the same reason.
696;00:56:42,651;00:56:44,899;Our reasons aren't your reasons.
697;00:56:44,900;00:56:47,275;It doesn't matter
697;00:56:44,900;00:56:47,275;what we think our reasons are.
698;00:56:49,484;00:56:51,274;There's a greater
698;00:56:49,484;00:56:51,274;purpose at work.
699;00:56:51,275;00:56:54,566;And we serve it together,
700;00:56:54,567;00:56:56,857;whether we know it or not.
701;00:56:56,858;00:56:59,775;We may take the steps,
701;00:56:56,858;00:56:59,775;but the Lord of Light--
702;00:56:59,776;00:57:03,149;For fuck's sake,
702;00:56:59,776;00:57:03,149;will you shut your hole?
703;00:57:03,150;00:57:05,941;Are we coming with you or not?
704;00:57:05,942;00:57:08,149;Don't you want to know
704;00:57:05,942;00:57:08,149;what we're doing?
705;00:57:08,150;00:57:12,566;Is it worse than sitting in a
705;00:57:08,150;00:57:12,566;freezing cell, waiting to die?
706;00:57:12,567;00:57:14,566;He's right.
707;00:57:14,567;00:57:16,567;We're all on the same side.
708;00:57:19,067;00:57:20,192;How can we be?
709;00:57:21,817;00:57:23,900;We're all breathing.
710;00:58:34,159;00:58:44,844;<font color=#ec14bd>Sync & corrections by honeybunny
710;00:58:34,159;00:58:44,844;www.addic7ed.com</font>
9999;00:00:0,500;00:00:2,00;<font color=#ffff00 size=14>www.tvsubtitles.net</font>
