1;00:00:04,275;00:00:06,234;Clegane, look into the flames.
2;00:00:06,484;00:00:07,775;What do you see?
3;00:00:07,776;00:00:09,567;A wall of ice.
4;00:00:10,651;00:00:11,983;The Wall.
5;00:00:13,609;00:00:15,274;The only thing standing
5;00:00:13,609;00:00:15,274;between us
6;00:00:15,275;00:00:16,941;and the army of the dead
6;00:00:15,275;00:00:16,941;is the Wall,
7;00:00:16,942;00:00:19,734;and the Wall hasn't been
7;00:00:16,942;00:00:19,734;properly manned in centuries.
8;00:00:20,067;00:00:21,525;Last time we saw The Night King,
9;00:00:21,526;00:00:22,567;it was at Hardhome.
10;00:00:22,983;00:00:25,816;Closest castle to Hardhome
10;00:00:22,983;00:00:25,816;is Eastwatch by the sea.
11;00:00:25,817;00:00:27,577;And that's where I'll go.
12;00:00:27,858;00:00:30,400;Looks like we're
12;00:00:27,858;00:00:30,400;the Nightswatch now.
13;00:00:33,942;00:00:36,776;This suits you, Lady Stark.
14;00:00:37,734;00:00:40,192;Jon left you in charge?
14;00:00:37,734;00:00:40,192;He did.
15;00:00:50,359;00:00:53,234;Lord Tarly.
15;00:00:50,359;00:00:53,234;I believe you know my son.
16;00:00:53,442;00:00:54,900;Do you fight with us...
17;00:00:55,692;00:00:57,858;or with the foreign savages
17;00:00:55,692;00:00:57,858;and eunuchs?
18;00:00:59,484;00:01:01,233;What do you think I should do?
19;00:01:01,234;00:01:03,983;If you use them to melt castles
19;00:01:01,234;00:01:03,983;and burn cities,
20;00:01:04,317;00:01:05,400;you're not different.
21;00:01:05,817;00:01:07,484;You're just more of the same.
22;00:01:09,317;00:01:10,651;Listen.
23;00:03:04,584;00:03:14,912;<font color=#ec14bd>Sync & corrections by honeybunny
23;00:03:04,584;00:03:14,912;www.addic7ed.com</font>
24;00:03:47,817;00:03:49,025;You could've killed me.
25;00:03:57,484;00:03:59,483;The fuck were you doing
25;00:03:57,484;00:03:59,483;back there?
26;00:03:59,484;00:04:01,775;Ending the war.
27;00:04:01,776;00:04:03,982;Killing her.
28;00:04:03,983;00:04:06,400;You saw the dragon
28;00:04:03,983;00:04:06,400;between you and her?
29;00:04:09,526;00:04:12,400;And?
30;00:04:19,150;00:04:20,982;Listen to me, cunt.
31;00:04:20,983;00:04:22,525;Till I get what I'm owed,
32;00:04:22,526;00:04:24,358;a dragon doesn't
32;00:04:22,526;00:04:24,358;get to kill you,
33;00:04:24,359;00:04:26,233;you don't get to kill you,
34;00:04:26,234;00:04:27,692;only I get to kill you.
35;00:04:30,817;00:04:33,691;That was only one of them.
36;00:04:33,692;00:04:36,525;She has two more.
37;00:04:36,526;00:04:39,608;If she decides to use them,
37;00:04:36,526;00:04:39,608;to really use them...
38;00:04:39,609;00:04:42,233;You're fucked.
38;00:04:39,609;00:04:42,233;Don't you mean we're fucked?
39;00:04:42,234;00:04:44,233;No, I do not.
40;00:04:44,234;00:04:47,399;Dragons are where
40;00:04:44,234;00:04:47,399;our partnership ends.
41;00:04:47,400;00:04:49,024;I'm not gonna be around
41;00:04:47,400;00:04:49,024;when those things
42;00:04:49,025;00:04:50,776;start spitting fire
42;00:04:49,025;00:04:50,776;on King's Landing.
43;00:04:52,817;00:04:54,275;I have to tell Cersei.
44;00:04:57,108;00:04:59,067;May as well jump
44;00:04:57,108;00:04:59,067;back in that river.
45;00:06:13,442;00:06:16,399;I know what Cersei has told you.
46;00:06:16,400;00:06:21,149;That I've come
46;00:06:16,400;00:06:21,149;to destroy your cities,
47;00:06:21,150;00:06:22,399;burn down your homes,
48;00:06:22,400;00:06:24,150;murder you,
48;00:06:22,400;00:06:24,150;and orphan your children.
49;00:06:26,983;00:06:30,775;That's Cersei Lannister, not me.
50;00:06:30,776;00:06:32,982;I'm not here to murder,
51;00:06:32,983;00:06:34,733;and all I want to destroy
52;00:06:34,734;00:06:37,816;is the wheel that has
52;00:06:34,734;00:06:37,816;rolled over rich and poor
53;00:06:37,817;00:06:42,025;to the benefit of no one but the
53;00:06:37,817;00:06:42,025;Cersei Lannisters of the world.
54;00:06:43,234;00:06:45,483;I offer you a choice--
55;00:06:45,484;00:06:47,816;bend the knee and join me.
56;00:06:47,817;00:06:51,982;Together, we will leave the world
56;00:06:47,817;00:06:51,982;a better place than we found it.
57;00:06:51,983;00:06:54,982;Or refuse...
58;00:06:54,983;00:06:56,484;and die.
59;00:07:25,484;00:07:27,025;Step forward, my lord.
60;00:07:36,192;00:07:38,149;You will not kneel?
61;00:07:38,150;00:07:39,526;I already have a queen.
62;00:07:40,734;00:07:42,233;My sister.
63;00:07:42,234;00:07:43,441;She wasn't your queen
64;00:07:43,442;00:07:45,483;until recently, though, was she?
65;00:07:45,484;00:07:47,816;When she murdered
65;00:07:45,484;00:07:47,816;your rightful queen
66;00:07:47,817;00:07:50,441;and destroyed House Tyrell
66;00:07:47,817;00:07:50,441;for all time.
67;00:07:50,442;00:07:53,734;So it appears your allegiances
67;00:07:50,442;00:07:53,734;are somewhat flexible.
68;00:07:54,858;00:07:57,775;There are
68;00:07:54,858;00:07:57,775;no easy choices in war.
69;00:07:57,776;00:08:00,149;Say what you will
69;00:07:57,776;00:08:00,149;about your sister,
70;00:08:00,150;00:08:02,650;she was born in Westeros.
71;00:08:02,651;00:08:04,900;She's lived here all her life.
72;00:08:06,900;00:08:09,733;You, on the other hand,
73;00:08:09,734;00:08:12,483;murdered your own father
74;00:08:12,484;00:08:15,608;and chose to support
74;00:08:12,484;00:08:15,608;a foreign invader.
75;00:08:15,609;00:08:18,442;One with no ties to this land...
76;00:08:20,067;00:08:22,442;with an army of savages
76;00:08:20,067;00:08:22,442;at her back.
77;00:08:24,275;00:08:26,108;You will not trade
77;00:08:24,275;00:08:26,108;your honor for your life.
78;00:08:28,108;00:08:29,566;I respect that.
79;00:08:29,567;00:08:32,608;Perhaps he could take
79;00:08:29,567;00:08:32,608;the Black, Your Grace.
80;00:08:32,609;00:08:35,024;Whatever else he is,
80;00:08:32,609;00:08:35,024;he is a true soldier.
81;00:08:35,025;00:08:37,274;He'd be invaluable at the Wall.
82;00:08:37,275;00:08:39,609;You cannot send me to the Wall.
83;00:08:40,983;00:08:42,609;You are not my queen.
84;00:08:56,067;00:08:57,399;You will have to kill me, too.
85;00:08:57,400;00:08:59,275;Step back and shut your mouth.
86;00:09:00,817;00:09:02,233;Who are you?
87;00:09:02,234;00:09:03,484;A stupid boy.
88;00:09:04,609;00:09:06,816;I am Dickon Tarly,
89;00:09:06,817;00:09:08,233;son of Randyll Tarly.
90;00:09:08,234;00:09:10,441;You are the future
90;00:09:08,234;00:09:10,441;of your house.
91;00:09:10,442;00:09:13,816;This war has already wiped one
91;00:09:10,442;00:09:13,816;great house from the world.
92;00:09:13,817;00:09:15,692;Don't let it happen again.
92;00:09:13,817;00:09:15,692;Bend the knee.
93;00:09:23,359;00:09:24,817;I will not.
94;00:09:29,150;00:09:32,857;Your Grace, nothing scrubs
94;00:09:29,150;00:09:32,857;bold notions from a man's head
95;00:09:32,858;00:09:34,441;like a few weeks in a dark cell.
96;00:09:34,442;00:09:37,107;I meant what I said.
97;00:09:37,108;00:09:38,650;I'm not here
97;00:09:37,108;00:09:38,650;to put men in chains.
98;00:09:38,651;00:09:40,982;If that becomes an option,
98;00:09:38,651;00:09:40,982;many will take it.
99;00:09:40,983;00:09:42,359;I gave them a choice.
100;00:09:43,858;00:09:45,191;They made it.
101;00:09:45,192;00:09:48,358;Your Grace, if you start
101;00:09:45,192;00:09:48,358;beheading entire families--
102;00:09:48,359;00:09:50,526;I'm not beheading anyone.
103;00:09:55,900;00:09:57,359;Your Grace.
104;00:10:21,692;00:10:25,233;Lord Randyll
104;00:10:21,692;00:10:25,233;Tarly, Dickon Tarly,
105;00:10:25,234;00:10:27,899;I, Daenerys of House
105;00:10:25,234;00:10:27,899;Targaryen, First of My Name,
106;00:10:27,900;00:10:31,024;Breaker of Chains,
106;00:10:27,900;00:10:31,024;and Mother of Dragons,
107;00:10:31,025;00:10:32,858;sentence you to die.
108;00:10:36,442;00:10:37,609;Dracarys.
109;00:11:25,609;00:11:27,150;My-- my lord...
110;00:11:37,067;00:11:38,651;How many men did we lose?
111;00:11:41,234;00:11:43,275;We haven't done
111;00:11:41,234;00:11:43,275;a full accounting.
112;00:11:44,983;00:11:48,441;It's not only armies
112;00:11:44,983;00:11:48,441;that win wars.
113;00:11:48,442;00:11:50,941;We have the Tyrell gold, we
113;00:11:48,442;00:11:50,941;have the Iron Bank behind us.
114;00:11:50,942;00:11:52,609;We can buy mercenaries.
115;00:11:54,526;00:11:56,399;Not the same as our men,
115;00:11:54,526;00:11:56,399;but they'll fight
116;00:11:56,400;00:11:58,608;if they're well paid,
116;00:11:56,400;00:11:58,608;which they will be.
117;00:11:58,609;00:12:02,066;I just saw the Dothraki fight.
118;00:12:02,067;00:12:03,691;They'll beat any mercenary army.
119;00:12:03,692;00:12:05,775;They'll beat any army
119;00:12:03,692;00:12:05,775;I've ever seen.
120;00:12:05,776;00:12:08,650;Killing our men wasn't war
120;00:12:05,776;00:12:08,650;for them, it was sport.
121;00:12:08,651;00:12:10,857;Her dragon burnt
121;00:12:08,651;00:12:10,857;a thousand wagons.
122;00:12:10,858;00:12:13,107;Qyburn's scorpion fired
122;00:12:10,858;00:12:13,107;bolts bigger than you.
123;00:12:13,108;00:12:15,651;They couldn't stop it.
123;00:12:13,108;00:12:15,651;And she has three of them.
124;00:12:17,692;00:12:19,608;This isn't a war we can win.
125;00:12:19,609;00:12:20,983;So, what do we do?
126;00:12:22,400;00:12:23,651;Sue for peace?
127;00:12:24,983;00:12:26,566;I sit on her father's throne,
128;00:12:26,567;00:12:29,233;the father you betrayed
128;00:12:26,567;00:12:29,233;and murdered.
129;00:12:29,234;00:12:32,066;And in her mind, she's winning.
130;00:12:32,067;00:12:34,150;What sort of offer
130;00:12:32,067;00:12:34,150;do you think she'd make?
131;00:12:36,609;00:12:40,024;Maybe we can count on Tyrion
131;00:12:36,609;00:12:40,024;to intercede on our behalf
132;00:12:40,025;00:12:42,400;by way of apology for
132;00:12:40,025;00:12:42,400;murdering our father and son.
133;00:12:44,150;00:12:45,650;He didn't.
134;00:12:45,651;00:12:47,650;You saw the crossbow,
134;00:12:45,651;00:12:47,650;you saw his body.
135;00:12:47,651;00:12:49,525;I'm not talking about Father.
136;00:12:49,526;00:12:53,066;Tyrion didn't kill Joffrey.
136;00:12:49,526;00:12:53,066;He had nothing to do with it.
137;00:12:53,067;00:12:56,359;After all this time, it still amazes me that you--
137;00:12:53,067;00:12:56,359;It was Olenna.
138;00:12:58,734;00:13:01,067;She confessed before she died.
139;00:13:03,359;00:13:05,608;And this was before or after
140;00:13:05,609;00:13:08,691;she drank the poison
140;00:13:05,609;00:13:08,691;you so kindly provided her?
141;00:13:08,692;00:13:10,316;After.
142;00:13:10,317;00:13:11,816;And you believed her?
143;00:13:11,817;00:13:14,566;If you were Olenna,
143;00:13:11,817;00:13:14,566;would you rather have seen
144;00:13:14,567;00:13:17,234;your granddaughter married
144;00:13:14,567;00:13:17,234;to Joffrey or Tommen?
145;00:13:19,609;00:13:21,982;Which one would Margaery have
145;00:13:19,609;00:13:21,982;been better able to control?
146;00:13:21,983;00:13:23,525;Which one would have made Olenna
147;00:13:23,526;00:13:26,233;the true ruler
147;00:13:23,526;00:13:26,233;of the Seven Kingdoms?
148;00:13:26,234;00:13:28,108;She was telling the truth.
149;00:13:35,484;00:13:37,692;I shouldn't have
149;00:13:35,484;00:13:37,692;listened to you.
150;00:13:39,484;00:13:41,274;She should have died screaming.
151;00:13:41,275;00:13:42,566;She's dead, like her son,
152;00:13:42,567;00:13:44,650;her grandchildren,
152;00:13:42,567;00:13:44,650;her whole house.
153;00:13:44,651;00:13:48,233;And if we don't find a way out
153;00:13:44,651;00:13:48,233;of this war, we'll follow them.
154;00:13:48,234;00:13:50,775;So we fight and die
154;00:13:48,234;00:13:50,775;or we submit and die.
155;00:13:50,776;00:13:52,941;I know my choice.
156;00:13:52,942;00:13:55,442;A soldier should know his.
157;00:16:02,567;00:16:04,733;They're beautiful, aren't they?
158;00:16:04,734;00:16:07,526;It wasn't the word
158;00:16:04,734;00:16:07,526;I was thinking of, but...
159;00:16:08,776;00:16:11,525;but, yes, they are.
160;00:16:11,526;00:16:13,024;Gorgeous beasts.
161;00:16:13,025;00:16:14,941;They're not beasts to me.
162;00:16:14,942;00:16:16,775;No matter how big they get
163;00:16:16,776;00:16:18,941;or how terrifying
163;00:16:16,776;00:16:18,941;to everyone else,
164;00:16:18,942;00:16:20,567;they're my children.
165;00:16:26,234;00:16:27,566;You weren't gone long.
166;00:16:27,567;00:16:29,733;No.
167;00:16:29,734;00:16:31,733;And?
168;00:16:31,734;00:16:34,442;And I have fewer enemies
168;00:16:31,734;00:16:34,442;today than I did yesterday.
169;00:16:37,108;00:16:39,191;You're not sure
169;00:16:37,108;00:16:39,191;how you feel about that.
170;00:16:39,192;00:16:40,900;No, I'm not.
171;00:16:42,817;00:16:44,274;How many men did your army kill
172;00:16:44,275;00:16:46,275;taking Winterfell back
172;00:16:44,275;00:16:46,275;from the Boltons?
173;00:16:47,442;00:16:48,816;Thousands.
174;00:16:48,817;00:16:50,941;We both want to help people.
175;00:16:50,942;00:16:54,650;We can only help them
175;00:16:50,942;00:16:54,650;from a position of strength.
176;00:16:54,651;00:16:56,734;Sometimes strength is terrible.
177;00:16:59,942;00:17:02,608;When you first came here,
178;00:17:02,609;00:17:06,358;Ser Davos said you took a knife
178;00:17:02,609;00:17:06,358;in the heart for your people.
179;00:17:06,359;00:17:07,983;Ser Davos gets carried away.
180;00:17:09,734;00:17:11,441;So, it was a figure of speech?
181;00:17:15,942;00:17:19,303;_
182;00:17:25,987;00:17:27,406;_
183;00:17:31,983;00:17:33,182;Your Grace.
184;00:17:39,025;00:17:42,399;Jon Snow, this is
184;00:17:39,025;00:17:42,399;Ser Jorah Mormont,
185;00:17:42,400;00:17:44,650;an old friend.
186;00:17:44,651;00:17:46,149;I served with your father.
187;00:17:46,150;00:17:48,317;He was a great man.
188;00:17:49,858;00:17:51,526;You look strong.
189;00:17:53,359;00:17:54,691;You found a cure?
190;00:17:54,692;00:17:56,650;I wouldn't be here if I hadn't.
191;00:17:56,651;00:18:01,149;I return to your
191;00:17:56,651;00:18:01,149;service, my queen,
192;00:18:01,150;00:18:02,941;if you'll have me.
193;00:18:02,942;00:18:05,317;It would be my honor.
194;00:19:44,776;00:19:46,233;Ravens.
195;00:19:46,234;00:19:48,067;We need to send ravens.
196;00:19:50,526;00:19:53,274;I put very little stock
196;00:19:50,526;00:19:53,274;in it myself.
197;00:19:53,275;00:19:55,733;Prophecies of doom
197;00:19:53,275;00:19:55,733;are never in short supply,
198;00:19:55,734;00:19:57,941;especially when winter comes.
199;00:19:57,942;00:20:00,274;I remember Wolkan.
200;00:20:00,275;00:20:02,650;A little timid,
200;00:20:00,275;00:20:02,650;but a sharp mind.
201;00:20:02,651;00:20:06,149;Eh, the North has dulled
201;00:20:02,651;00:20:06,149;many good maesters' wits.
202;00:20:06,150;00:20:08,358;Hard to say whether
202;00:20:06,150;00:20:08,358;it's the cold, the drink,
203;00:20:08,359;00:20:10,149;or the company.
204;00:20:10,150;00:20:12,316;A crippled boy
204;00:20:10,150;00:20:12,316;claims to have seen
205;00:20:12,317;00:20:14,441;dead men on the march
205;00:20:12,317;00:20:14,441;beyond the Wall,
206;00:20:14,442;00:20:17,608;thanks to the magical help
206;00:20:14,442;00:20:17,608;of a raven with three eyes?
207;00:20:17,609;00:20:19,274;Yes, it is a bit much.
208;00:20:19,275;00:20:21,983;Still, we ought to write back--
208;00:20:19,275;00:20:21,983;Brandon Stark.
209;00:20:25,484;00:20:28,651;The crippled boy.
209;00:20:25,484;00:20:28,651;Do you know him?
210;00:20:29,817;00:20:31,982;I led him through
210;00:20:29,817;00:20:31,982;the Wall years ago.
211;00:20:31,983;00:20:35,149;I saw him go beyond the Wall.
212;00:20:35,150;00:20:36,733;And?
213;00:20:36,734;00:20:39,650;Somehow, a crippled boy
214;00:20:39,651;00:20:41,733;survived for years beyond the
214;00:20:39,651;00:20:41,733;Wall when no one else could.
215;00:20:41,734;00:20:45,484;Not the Night's Watch,
215;00:20:41,734;00:20:45,484;not the wildlings, no one.
216;00:20:47,108;00:20:49,191;Perhaps we ought to listen
216;00:20:47,108;00:20:49,191;to what he has to say.
217;00:20:49,192;00:20:52,316;Perhaps you need more scribing
217;00:20:49,192;00:20:52,316;work to discipline your mind.
218;00:20:52,317;00:20:55,734;I sense a more detailed
218;00:20:52,317;00:20:55,734;proposal is forthcoming?
219;00:21:06,359;00:21:10,358;Everyone in Westeros
219;00:21:06,359;00:21:10,358;trusts and respects you.
220;00:21:10,359;00:21:14,525;If you tell people the threat
220;00:21:10,359;00:21:14,525;is real, they'll believe it.
221;00:21:14,526;00:21:16,899;If you advise all the lords
221;00:21:14,526;00:21:16,899;to send their men north
222;00:21:16,900;00:21:18,857;to hold the Wall, they'll do it.
223;00:21:18,858;00:21:22,358;And if you tell every
223;00:21:18,858;00:21:22,358;maester in the Citadel
224;00:21:22,359;00:21:24,691;to search every word
224;00:21:22,359;00:21:24,691;of every faded scroll
225;00:21:24,692;00:21:26,483;about the Long Night,
226;00:21:26,484;00:21:28,316;they may find something
226;00:21:26,484;00:21:28,316;that lets us defeat
227;00:21:28,317;00:21:30,234;the Army of the Dead for good.
228;00:21:35,317;00:21:36,526;It could be done.
229;00:21:37,942;00:21:40,733;And this news
229;00:21:37,942;00:21:40,733;could be authentic.
230;00:21:40,734;00:21:42,400;It's possible.
231;00:21:44,900;00:21:47,233;It's also possible
231;00:21:44,900;00:21:47,233;that this message
232;00:21:47,234;00:21:49,525;is part of a ploy
232;00:21:47,234;00:21:49,525;by the Dragon Queen
233;00:21:49,526;00:21:52,483;to lure southern armies away from the
233;00:21:49,526;00:21:52,483;lands they are currently defending
234;00:21:52,484;00:21:54,525;to open those lands
234;00:21:52,484;00:21:54,525;to easy conquest.
235;00:21:54,526;00:21:56,233;That does seem far more likely
236;00:21:56,234;00:21:58,191;than magic birds
236;00:21:56,234;00:21:58,191;talking to cripples.
237;00:21:58,192;00:22:00,733;Archmaester, please.
238;00:22:00,734;00:22:01,900;It's real.
239;00:22:03,817;00:22:04,900;I've seen it.
240;00:22:07,734;00:22:09,233;We will write to Maester Wolkan
241;00:22:09,234;00:22:11,608;at Winterfell for clarification.
242;00:22:11,609;00:22:14,483;I promise you we will get to the
242;00:22:11,609;00:22:14,483;truth of it one way or another.
243;00:22:14,484;00:22:17,191;Archmaester, please--
243;00:22:14,484;00:22:17,191;That will be all, Tarly.
244;00:22:17,192;00:22:19,691;It brings to mind the
244;00:22:17,192;00:22:19,691;work of Jenny of Oldstones,
245;00:22:19,692;00:22:22,316;the charlatan who claimed descent
245;00:22:19,692;00:22:22,316;from the children of the forest.
246;00:22:22,317;00:22:25,107;Don't forget the prophet Lodos,
247;00:22:25,108;00:22:28,775;who promised that the Drowned God would
247;00:22:25,108;00:22:28,775;rise up and destroy Aegon the Conqueror.
248;00:22:28,776;00:22:31,067;Ah, Lodos.
249;00:22:34,359;00:22:38,899;Is he the one whose father and
249;00:22:34,359;00:22:38,899;brother were just burnt alive?
250;00:22:38,900;00:22:40,857;I'm afraid so.
251;00:22:40,858;00:22:42,107;Horrible business.
252;00:22:42,108;00:22:44,733;I haven't had the heart
252;00:22:42,108;00:22:44,733;to tell him yet.
253;00:22:44,734;00:22:46,775;He's a good lad.
254;00:22:46,776;00:22:48,525;Right.
255;00:22:48,526;00:22:51,441;The ravenry was falling apart
255;00:22:48,526;00:22:51,441;the last time I checked.
256;00:22:56,651;00:22:59,274;All rulers demand
256;00:22:56,651;00:22:59,274;that people bend the knee.
257;00:22:59,275;00:23:00,484;That's why they're rulers.
258;00:23:03,609;00:23:05,608;She gave Tarly a choice,
259;00:23:05,609;00:23:08,441;a man who had taken up
259;00:23:05,609;00:23:08,441;arms against her.
260;00:23:08,442;00:23:10,191;What else could she do?
261;00:23:10,192;00:23:13,316;Not burn him alive
261;00:23:10,192;00:23:13,316;alongside his son?
262;00:23:13,317;00:23:15,650;I am her Hand, not her head.
263;00:23:15,651;00:23:17,899;I can't make
263;00:23:15,651;00:23:17,899;her decisions for her.
264;00:23:17,900;00:23:21,191;That's what I used to tell
264;00:23:17,900;00:23:21,191;myself about her father.
265;00:23:21,192;00:23:25,566;I found the traitors, but I wasn't
265;00:23:21,192;00:23:25,566;the one burning them alive.
266;00:23:25,567;00:23:28,317;I was only a purveyor
266;00:23:25,567;00:23:28,317;of information.
267;00:23:33,484;00:23:37,525;It's what I told myself when I
267;00:23:33,484;00:23:37,525;watched them beg for mercy--
268;00:23:37,526;00:23:40,107;I'm not the one doing it.
269;00:23:40,108;00:23:42,566;When the pitch of their
269;00:23:40,108;00:23:42,566;screams rose higher--
270;00:23:42,567;00:23:44,608;I'm not the one doing it.
271;00:23:44,609;00:23:46,191;When their hair caught fire
272;00:23:46,192;00:23:49,066;and the smell of their burning
272;00:23:46,192;00:23:49,066;flesh filled the throne room--
273;00:23:49,067;00:23:50,692;I'm not the one doing it.
274;00:23:59,359;00:24:01,566;Daenerys is not her father.
275;00:24:01,567;00:24:03,982;And she never will be
276;00:24:03,983;00:24:06,025;with the right counsel.
277;00:24:09,275;00:24:11,692;You need to find a way
277;00:24:09,275;00:24:11,692;to make her listen.
278;00:24:14,150;00:24:17,525;Who's that for?
278;00:24:14,150;00:24:17,525;Jon Snow.
279;00:24:17,526;00:24:19,066;Did you read it?
280;00:24:19,067;00:24:22,108;It's a sealed scroll
280;00:24:19,067;00:24:22,108;for the King in the North.
281;00:24:28,234;00:24:29,692;What's it say?
282;00:24:30,776;00:24:32,359;Nothing good.
283;00:24:38,858;00:24:42,233;I thought Arya was dead.
284;00:24:42,234;00:24:45,316;I thought Bran was dead.
285;00:24:45,317;00:24:46,734;I'm happy for you.
286;00:24:49,108;00:24:50,525;You don't look happy.
287;00:24:50,526;00:24:52,899;Bran saw the Night King
287;00:24:50,526;00:24:52,899;and his army
288;00:24:52,900;00:24:54,900;marching towards Eastwatch.
289;00:24:56,484;00:24:58,483;If they make it past the Wall...
290;00:24:58,484;00:25:01,191;The Wall has kept them out for
290;00:24:58,484;00:25:01,191;thousands of years, presumably.
291;00:25:01,192;00:25:02,857;I need to go home.
292;00:25:02,858;00:25:04,566;You said you don't
292;00:25:02,858;00:25:04,566;have enough men.
293;00:25:04,567;00:25:07,149;We'll fight
293;00:25:04,567;00:25:07,149;with the men we have.
294;00:25:07,150;00:25:08,775;Unless you'll join us.
295;00:25:08,776;00:25:10,941;And give the country to Cersei?
296;00:25:10,942;00:25:14,775;As soon as I march away,
296;00:25:10,942;00:25:14,775;she marches in.
297;00:25:14,776;00:25:17,107;Perhaps not.
298;00:25:17,108;00:25:20,525;Cersei thinks the Army of the
298;00:25:17,108;00:25:20,525;Dead is nothing but a story
299;00:25:20,526;00:25:23,775;made up by wet nurses
299;00:25:20,526;00:25:23,775;to frighten children.
300;00:25:23,776;00:25:25,525;What if we prove her wrong?
301;00:25:25,526;00:25:28,942;I don't think she'll come see
301;00:25:25,526;00:25:28,942;the dead at my invitation.
302;00:25:30,234;00:25:32,275;So bring the dead to her.
303;00:25:33,734;00:25:35,608;I thought that was what
303;00:25:33,734;00:25:35,608;we were trying to avoid.
304;00:25:35,609;00:25:37,982;We don't have to
304;00:25:35,609;00:25:37,982;bring the whole army.
305;00:25:37,983;00:25:40,024;Only one soldier.
306;00:25:40,025;00:25:41,942;Is that possible?
307;00:25:45,776;00:25:47,483;The first wight I ever saw
308;00:25:47,484;00:25:50,316;was brought into Castle
308;00:25:47,484;00:25:50,316;Black from beyond the Wall.
309;00:25:50,317;00:25:52,650;Bring one of these things
309;00:25:50,317;00:25:52,650;down to King's Landing
310;00:25:52,651;00:25:54,941;and show her the truth.
311;00:25:54,942;00:25:56,982;Anything you bring back
311;00:25:54,942;00:25:56,982;will be useless
312;00:25:56,983;00:25:58,816;unless Cersei
312;00:25:56,983;00:25:58,816;grants us an audience
313;00:25:58,817;00:26:01,358;and is somehow convinced
313;00:25:58,817;00:26:01,358;not to murder us
314;00:26:01,359;00:26:03,608;the moment we set foot
314;00:26:01,359;00:26:03,608;in the capital.
315;00:26:03,609;00:26:07,191;The only person
315;00:26:03,609;00:26:07,191;she listens to is Jaime.
316;00:26:07,192;00:26:09,025;He might listen to me.
317;00:26:13,025;00:26:14,858;And how would you get
317;00:26:13,025;00:26:14,858;into King's Landing?
318;00:26:21,025;00:26:22,857;I can smuggle you in,
319;00:26:22,858;00:26:25,483;but if the gold cloaks
319;00:26:22,858;00:26:25,483;were to recognize you,
320;00:26:25,484;00:26:28,691;I'm warning you,
320;00:26:25,484;00:26:28,691;I'm not a fighter.
321;00:26:28,692;00:26:30,107;Well, it will all be for nothing
322;00:26:30,108;00:26:31,899;if we don't have
322;00:26:30,108;00:26:31,899;one of these dead men.
323;00:26:31,900;00:26:33,274;Fair point.
324;00:26:33,275;00:26:34,567;How do you propose to find one?
325;00:26:37,983;00:26:41,192;With the queen's permission,
325;00:26:37,983;00:26:41,192;I'll go north and take one.
326;00:26:42,900;00:26:46,233;You asked me to find a
326;00:26:42,900;00:26:46,233;cure so I could serve you.
327;00:26:46,234;00:26:47,858;Allow me to serve you.
